Title,Studios,Year,Genre,Director,Producers,Cast,AvgRating,Duration,Description,Poster URL,Page URL
Turtles All the Way Down,"Temple Hill Entertainment, New Line Cinema",2024,"Romance, Drama",Hannah Marks,"Wyck Godfrey, Isaac Klausner, Marty Bowen","Isabela Merced, Cree Cicchino, Judy Reyes, Felix Mallard, Maliq Johnson, Miles Ekhardt, J. Smith-Cameron, Poorna Jagannathan, Tim Gooch, Jason Kientz, Hannah Marks, Sheila Gray Robinson, Rico Romalus Parker, Debby Ryan, Kaleigh Howland, John Green, Phillip Shaun DeVone, Tamika Tyan, Kevin Crowley, Jenny McManus",3.3,109,"Aza confronts her potential for love, happiness, friendship, and hope while navigating an endless barrage of invasive, obsessive thoughts.",https://a.ltrbxd.com/resized/film-poster/5/0/2/6/2/0/502620-turtles-all-the-way-down-0-230-0-345-crop.jpg?v=e369f9e654,https://letterboxd.com/film/turtles-all-the-way-down/
Phone Booth,"Fox 2000 Pictures, Zucker/Netter Productions",2002,"Thriller, Crime",Joel Schumacher,"David Zucker, Gil Netter, Eli Richbourg","Colin Farrell, Kiefer Sutherland, Forest Whitaker, Radha Mitchell, Katie Holmes, Paula Jai Parker, Arian Ash, Tia Texada, John Enos III, Richard T. Jones, Keith Nobbs, Dell Yount, James MacDonald, Josh Pais, Yorgo Constantine, Colin Patrick Lynch, Troy Gilbert, Seth William Meier, Svetlana Efremova, Billy Erb, Domenick Lombardozzi, Maile Flanagan, Tom Reynolds, Julio Oscar Mechoso, Karara Muhoro, Zidu Chen, Shu Lan Tuan, Dean Cochran, Amy Kowallis, Tory Kittles, Bruce Roberts, Tyree Michael Simpson, Dean Tarrolly, Mary Randle, Paul Fontana, Steve Alterman, Kimberly Bailey, Jason Broad, Lanei Chapman, Django Craig, Judith Durand, Greg Finley, Ramón Franco, Anneliese Goldman, Rick Gonzales, Tracy Metro, Jason Pace, Juan Pope, Nicole Prescott, Cheryl Tyre Smith, John Vargas, Tanya Vidal, Billy 'Sly' Williams, Ruth Zalduondo, Ben Foster, Jared Leto, Mia Cottet",3.3,81,"A slick New York publicist who picks up a ringing receiver in a phone booth is told that if he hangs up, he’ll be killed… and the little red light from a laser rifle sight is proof that the caller isn’t kidding.",https://a.ltrbxd.com/resized/sm/upload/ma/ho/yr/w8/xIaUpPok8WFnr79EAvgtGsIaJzV-0-230-0-345-crop.jpg?v=527d66c84e,https://letterboxd.com/film/phone-booth/
Resident Evil: Apocalypse,"Davis Films/Impact Pictures, Screen Gems, Constantin Film",2004,"Action, Science Fiction, Horror",Alexander Witt,"Paul W. S. Anderson, Don Carmody, Jeremy Bolt, Hiroyuki Kobayashi, Daniel S. Kletzky","Milla Jovovich, Sienna Guillory, Oded Fehr, Thomas Kretschmann, Sophie Vavasseur, Razaaq Adoti, Jared Harris, Mike Epps, Sandrine Holt, Matthew G. Taylor, Zack Ward, Iain Glen, Dave Nichols, Stefen Hayes, Geoffrey Pounsett, Shaun Austin-Olsen, Geny Walters, Megan Fahlenbock, Robert Morelli, Aaron Abrams, Chris Benson, Martin Martinuzzi, Brad Borbridge, Frank Chiesurin, Ron Benjamin, Kevin Hare, Heather Dick, Alex Courey, John De Toro, Billy Khoury, Sava Drayton, Nicole Ann St. Hill, Ricardo Betancourt, Ted Ludzik, Michelle Latimer, Catherine Burdon, Rebecca Sims, Christopher Weedon, Billy Parrott, Derek Aasland, Richard Harte, Simon Girard, Dean Copkov, Jeff White, Timothy Burd, Natalie Charles, Pierre Henry, Jim Codrington, Deborah Valente, Malcolm Fiddick, Malcolm Xerxes, Michy Gustavia, Shane Mackinnon, Ed Fielding, Stephen R. Hart, Sandi Stahlbrand, Christopher Marren, Tom Gerhardt, Amber Marshall, Venice Grant, Ana Danilina, Ingrid Johansson, Jeffrey Weedon, Melanie Tonello, Annabel Chu, Joe Jefferson, Heather Braaten, Joe Silvaggio, Eric Morgan, Gene Pyrz, Torquil Colbo, Joan Moore, Peter C. Wylde, Garry Geddes, Dionne Renee, Janessa Crimi, Dan Ellery, Sharon Moore, Jo Chim, Bobby Prochaska, Jazz Mann, Larissa Gomes, Gregory White, Roman Podhora, Brian King, Rob Hall, John Migliore, Yaron Betan, Martin Crewes, Brandon Marc Gagne, Ryan McCluskey, Michael C. Newsome, Avi Salem, Alexander Witt",2.6,94,"As the city is locked down under quarantine, Alice finds out that the people that died from the previous incident at the Umbrella Corporation have turned into zombies. She then joins a small band of elite soldiers, who are enlisted to rescue the missing daughter of the creator of the mutating T-virus.  Once lack of luck and resources happen, they begin to wage an exhilarating battle to survive and escape before the Umbrella Corporation erases its experiment from the face of the earth. ×",https://a.ltrbxd.com/resized/film-poster/5/0/9/5/7/50957-resident-evil-apocalypse-0-230-0-345-crop.jpg?v=776c9eeeac,https://letterboxd.com/film/resident-evil-apocalypse/
A Taxi Driver,"The LAMP, Showbox",2017,"Drama, History, Action",Jang Hoon,Seo Kang-ho,"Song Kang-ho, Thomas Kretschmann, Yoo Hai-jin, Ryu Jun-yeol, Park Hyeok-kwon, Choi Gwi-hwa, Cha Soon-bae, Shin Dam-su, Ryu Sung-hyun, Um Tae-goo, Min-hee Park, Lee Jung-eun, Eun-mi Yoo, Seo Hyun-woo, Ko Chang-seok, Jeon Hye-jin, Joey Albright, Jung Jin-young, Ryu Tae-ho, Jeong Seok-yong, Heo Jeong-do, Kyul Hwi, Lee Sae-byeol, Lee Ho-cheol, Lee Yong-i, Han Sa-myeong, Choi Jae-sup, Yang Shin-ji, Lee Bong-ryeon, Park Sung-hyun, Son Jong-hwan, Jang Ji-woong",4.2,138,"May, 1980. Man-seob is a taxi driver in Seoul who lives from hand to mouth, raising his young daughter alone. One day, he hears that there is a foreigner who will pay big money for a drive down to Gwangju city. Not knowing that he’s a German journalist with a hidden agenda, Man-seob takes the job.",https://a.ltrbxd.com/resized/film-poster/3/6/9/8/5/6/369856-a-taxi-driver-0-230-0-345-crop.jpg?v=8787b2effd,https://letterboxd.com/film/a-taxi-driver/
Days of Being Wild,In-Gear Film Production Co. Ltd.,1990,"Drama, Romance, Crime",Wong Kar-wai,"Rover Tang, Comfort Chan","Leslie Cheung, Andy Lau, Maggie Cheung, Carina Lau, Jacky Cheung, Rebecca Pan, Tony Leung, Maritoni Fernandez, Alicia Alonzo, Tita Muñoz, Hung Ling-Ling, Angela Ponos, Danilo Antunes, Elena Lim So, Mei-Mei Hung, Nonong Talbo, Mama Hung",3.8,94,"Yuddy, a Hong Kong playboy known for breaking girls’ hearts, tries to find solace and the truth after discovering the woman who raised him isn’t his mother.",https://a.ltrbxd.com/resized/film-poster/4/0/4/3/4/40434-days-of-being-wild-0-230-0-345-crop.jpg?v=6d9f15154f,https://letterboxd.com/film/ah-fei-jing-juen/
The Fundamentals of Caring,"Worldwide Pants, Levantine Entertainment",2016,"Comedy, Drama",Rob Burnett,"Donna Gigliotti, James Spies, Rob Burnett","Paul Rudd, Craig Roberts, Selena Gomez, Jennifer Ehle, Megan Ferguson, Frederick Weller, Julia Denton, Alex Huff, Samantha Huskey, Bill Murphey, Alan Boell, Robert Walker Branchaud, Eric Singer, James Donadio, Donna Biscoe, Ashley White, Matthew Pruitt, Matt Mercurio, Bobby Cannavale, Walter Hendrix III, Kristi Von",3.5,97,"Having suffered a tragedy, Ben becomes a caregiver to earn money. His first client, Trevor, is a hilarious 18-year-old with muscular dystrophy. One paralyzed emotionally, one paralyzed physically, Ben and Trevor hit the road on a trip into the western states. The folks they collect along the way will help them test their skills for surviving outside their calculated existence. Together, they come to understand the importance of hope and the necessity of true friendship. ×",https://a.ltrbxd.com/resized/sm/upload/ov/xt/n5/uw/yLnbPJcd4nZeK9QQZro4GIDftyY-0-230-0-345-crop.jpg?v=6bd5eb3a7e,https://letterboxd.com/film/the-fundamentals-of-caring/
The Clovehitch Killer,End Cue,2018,"Drama, Crime, Mystery",Duncan Skiles,"Andrew Kortschak, Cody Ryder, Walter Kortschak, Duncan Skiles, Christopher Ford, Lisa Ciuffetti, Stephanie Whonsetler","Dylan McDermott, Charlie Plummer, Samantha Mathis, Madisen Beaty, Brenna Sherman, Lance Chantiles-Wertz, Emma Jones, Jonathan Riggs, Katarina Perez, Mark A. Nash, Stan Simonov, Michael Urriquia, Gabe Litwin, Mike Cortese, Allie Moisan, Brian Ott, Sarah Cleveland",3.2,109,A picture-perfect family is torn apart after Tyler finds a cache of disturbing images in his father’s possession. He begins to suspect that the man he trusts most in the world may be responsible for the murder of 13 women ten years prior.,https://a.ltrbxd.com/resized/film-poster/4/7/3/3/1/9/473319-the-clovehitch-killer-0-230-0-345-crop.jpg?v=1c093e47a7,https://letterboxd.com/film/the-clovehitch-killer/
Yesterday,"Working Title Films, Working Title Films",2019,"Comedy, Fantasy, Romance, Music",Danny Boyle,"Tim Bevan, Matthew James Wilkinson, Richard Curtis, Bernard Bellew, Danny Boyle, Eric Fellner","Himesh Patel, Lily James, Sophia Di Martino, Ellise Chappell, Meera Syal, Harry Michell, Vincent Franklin, Joel Fry, Michael Kiwanuka, Karma Sood, Gus Brown, Sanjeev Bhaskar, Karl Theobald, Alexander Arnold, Dominic Coleman, Ed Sheeran, Jane Seaborn, Nic Minns, Maryana Spivak, Justin Edwards, Kate McKinnon, Javone Prince, Camilla Rutherford, Sarah Lancashire, Rachael Elizabeth, Jimmy Gallagher, Jaimie Kollmer, Sophie Mensah, Helena Devereux, Julian Feria, Lamorne Morris, Craig Rowin, James Corden, Cristina Dohmen, Elizabeth Berrington, Clementine Webb, Diana Pauline, William McGeough, Díana Bermudez, Sunny Yeo, Charlie Hannah, Xav Clarke, Oliver Booker, Michele Stodart, Michael Jablonka, Steve Pringle, Lewis Wright, Alex Bonfanti, Ifeoluwa Ogunjobi, Camilla George, Hannah Mbuya, Richie Seivwright, Chilli-Rae McCormack, Lucie Arnoux, Jelly Cleaver, Daisy Chute, Sandra-Mae Luijkx, Robert Carlyle, David Lautman, K.C. Wolf, Hiten Patel, Saul Shlosberg, Neilesh Ambu",2.9,116,A struggling musician realizes he’s the only person on Earth who can remember The Beatles after waking up in an alternate reality where the group was forgotten.,https://a.ltrbxd.com/resized/film-poster/4/4/4/7/9/9/444799-yesterday-0-230-0-345-crop.jpg?v=5f26868151,https://letterboxd.com/film/yesterday-2019/
"Extremely Wicked, Shockingly Evil and Vile","Ninjas Runnin' Wild Productions, Voltage Pictures, COTA Films",2019,"Crime, Drama",Joe Berlinger,"Michael Simkin, Amy Greene, Ara Keshishian, Sam Broadwin, Nicolas Chartier, Michael Costigan, Joe Berlinger, Narine Garibyan, Daniel McGilvray, James Uminowicz, Patriciana Tenicela","Zac Efron, Lily Collins, Kaya Scodelario, Jeffrey Donovan, Angela Sarafyan, Dylan Baker, Brian Geraghty, Terry Kinney, Haley Joel Osment, James Hetfield, Grace Victoria Cox, Jim Parsons, John Malkovich, Sydney Vollmer, Macie Carmosino, Ava Inman, Morgan Pyle, Richard K. Jones, Justin Inman, Alan B. Jones, Maya Berlinger, Derek Snow, Leilani Barrett, Ryan Wesley Gilreath, Ken Strunk, Jared Joplin, Justin McCombs, Joe Berlinger, Brandon Trost, Tim Young, Torrie Wiggins, Chris Petty, Kevin McClatchy, Paul Kulis, Michael Simkin, Tess Talbot, David Myers Gregory, Ming Wang, Sarah Berlinger, Claire Sinofsky, Caroline Hurwitz, Savannah Rodin, James Harper, Forba Shepherd, Barry Mulholland, Joey Boyd, Ally Sereda, Grace Balbo, Amy Greene, Chris Hahn, Rajiim A. Gross, Calvin David Jones III, James Siderits, Bret Aaron Knower, John E. Brownlee, Jerry Mullins",3.1,111,"A chronicle of the crimes of Ted Bundy, from the perspective of his longtime girlfriend, Elizabeth Kloepfer, who refused to believe the truth about him for years.",https://a.ltrbxd.com/resized/film-poster/3/8/9/6/3/7/389637-extremely-wicked-shockingly-evil-and-vile-0-230-0-345-crop.jpg?v=bea317d22f,https://letterboxd.com/film/extremely-wicked-shockingly-evil-and-vile/
Lamb,"Go to Sheep, Film i Väst, Chimney Sweden, Chimney Poland",2021,"Drama, Fantasy, Horror",Valdimar Jóhannsson,"Alicja Grawon-Jaksik, Peter Gustafsson, Marcin Luczaj, Sara Nassim, Jan Naszewski, Erik Rydell, Klaudia Śmieja-Rostworowska, Zuzanna Hencz, Helgi Jóhannsson, Hrönn Kristinsdóttir","Noomi Rapace, Hilmir Snær Guðnason, Björn Hlynur Haraldsson, Ingvar E. Sigurðsson, Ester Bibi, Sigurður Elvar Viðarson, Theodór Ingi Ólafsson, Arnþruður Dögg Sigurðardóttir, Gunnar Þor Karlsson, Lára Björk Hall",3.1,106,"An Icelandic couple live with their herd of sheep on a beautiful but remote farm. When they discover a mysterious newborn on their land, they decide to keep it and raise it as their own. This unexpected development and the prospects of a new family brings them much joy before ultimately destroying them.",https://a.ltrbxd.com/resized/film-poster/7/0/7/1/1/4/707114-lamb-0-230-0-345-crop.jpg?v=06329d82b2,https://letterboxd.com/film/lamb-2021/
Je Tu Il Elle,"Paradise Films, French Ministry of Foreign Affairs",1974,"Drama, Romance",Chantal Akerman,Chantal Akerman,"Chantal Akerman, Niels Arestrup, Claire Wauthion",3.7,86,A woman suffers a subdued psychological breakdown in the wake of a devastating breakup.,https://a.ltrbxd.com/resized/film-poster/7/8/0/1/3/78013-je-tu-il-elle-0-230-0-345-crop.jpg?v=cf23035b7c,https://letterboxd.com/film/je-tu-il-elle/
Monster,"Media 8 Entertainment, DEJ Productions, K/W Productions, Denver & Delilah Productions, VIP Medienfonds 2, MDP Worldwide, Taurus Film",2003,"Drama, Crime",Patty Jenkins,"Mark Damon, Charlize Theron, Brad Wyman, Clark Peterson, Donald Kushner, Brent Morris, David Alvarado","Charlize Theron, Christina Ricci, Bruce Dern, Lee Tergesen, Annie Corley, Pruitt Taylor Vince, Marco St. John, Marc Macaulay, Scott Wilson, Rus Blackwell, Tim Ware, Stephan Jones, Brett Rice, Kaitlin Riley, Cree Ivey, Catherine Mangan, Magdalena Manville, T. Robert Pigott, Romonda Shaver, Glenn R. Wilder, Elaine Stebbins, Kane Hodder, Christian Stokes, Lyllian Barcaski, Nonalee Davis, Bubba Baker, Al, Cannonball, Chad Vaccarino, Gene R. Stephenson, Jesse Stern, Billy Boylan, Jim R. Coleman, Chandra Leigh, Lori McDonald, Adam Brown, Ed Donovan",3.6,110,"An emotionally scarred highway drifter shoots a sadistic trick who rapes her, and ultimately becomes America’s first female serial killer.",https://a.ltrbxd.com/resized/film-poster/5/1/6/0/6/51606-monster-0-230-0-345-crop.jpg?v=3960562901,https://letterboxd.com/film/monster/
Unstoppable,"20th Century Fox, Dune Entertainment, Prospect Park, Ingenious Media, Scott Free Productions, Big Screen Productions",2010,"Thriller, Action",Tony Scott,"Julie Yorn, Tony Scott, Mimi Rogers, Eric McLeod, Alex Young, Adam Somner, Skip Chaisson, Lee Trink, Diane L. Sabatini","Denzel Washington, Chris Pine, Rosario Dawson, Kevin Dunn, Ethan Suplee, Kevin Corrigan, Lew Temple, Kevin Chapman, Jessy Schram, Elizabeth Mathis, Meagan Tandy, David Warshofsky, Andy Umberger, T.J. Miller, Dylan Bruce, Jeff Hochendoner, Ryan Ahern, Christopher Lee Philips, Kevin McClatchy, Toni Saladna, Patrick McDade, Jeff Wincott, Rick Chambers, Bud Davis, Bill Laing, Scott A. Martin, Richard Pelzman, Lissa Brennan, Heather Morgan Leigh, Barry Ben Sr., Carla Bianco, Keith Michael Gregory, L. Derek Leonidoff, Aisha Hinds, David Flick, Rebecca Harris, Joshua Elijah Reese, Jason McCune, Adrienne Wehr, Tom Stoviak, Joe Coyle, Dihlon McManne, Charles Van Eman, Matthew J. Cates, Warren Sweeney, Chase Ellison, Stephen Monroe Taylor, Jarrod DiGiorgi, Finder's Key, Mike Clark",3.3,98,"When a massive, unmanned locomotive roars out of control, the threat is more ominous than just a derailment. The train is laden with toxic chemicals, and an accident would decimate human life and cause an environmental disaster. The only hope of bringing the train to a safe stop is in the hands of veteran engineer Frank Barnes, and young conductor Will Colson, who must risk their lives to save those in the runaway’s path. Inspired by true events.",https://a.ltrbxd.com/resized/film-poster/2/1/1/1/6/21116-unstoppable-0-230-0-345-crop.jpg?v=194aa7cb39,https://letterboxd.com/film/unstoppable-2010/
The Sword in the Stone,Walt Disney Productions,1963,"Family, Animation, Fantasy",Wolfgang Reitherman,Walt Disney,"Sebastian Cabot, Karl Swenson, Junius Matthews, Martha Wentworth, Norman Alden, Rickie Sorensen, Ginny Tyler, Alan Napier, Richard Reitherman, Robert Reitherman, Barbara Jo Allen, James MacDonald, Tudor Owen, Thurl Ravenscroft, Jack Albertson, Fred Darian",3.4,79,"Wart is a young boy who aspires to be a knight’s squire. On a hunting trip he falls in on Merlin, a powerful but amnesiac wizard who has plans for him beyond mere squiredom. He starts by trying to give him an education, believing that once one has an education, one can go anywhere. Needless to say, it doesn’t quite work out that way.",https://a.ltrbxd.com/resized/film-poster/4/7/3/6/6/47366-the-sword-in-the-stone-0-230-0-345-crop.jpg?v=1983eb1914,https://letterboxd.com/film/the-sword-in-the-stone/
The Passion of the Christ,Icon Productions,2004,Drama,Mel Gibson,"Stephen McEveety, Mel Gibson, Bruce Davey","Jim Caviezel, Maia Morgenstern, Christo Jivkov, Francesco De Vito, Monica Bellucci, Mattia Sbragia, Toni Bertorelli, Luca Lionello, Hristo Shopov, Claudia Gerini, Fabio Sartor, Giacinto Ferro, Aleksander Mincer, Sheila Mokhtari, Lucio Allocca, Paco Reconti, Adel Bakri, Luciano Dragone, Adel Ben Ayed, Franco Costanzo, Lino Salemme, Emanuele Gullotto, Francesco De Rosa, Maurizio Di Carmine, Francesco Gabriele, Angelo Di Loreta, Federico Pacifici, Roberto Santi, Giovanni Vettorazzo, Ted Rusoff, Tom Shaker, Andrea Coppola, Romuald Kłos, Giuseppe Lo Console, Dario D'Ambrosi, Luciano Federico, Domenico Capalbo, Valerio Esposito, Antonello Iacovone, Nicola Tagarelli, Ivan Gaudiano, Chokri Ben Zagden, Roberto Bestazzoni, Luca De Dominicis, Pietro Sarubbi, Abel Jafri, Lello Giulivo, Emilio De Marchi, Roberto Visconti, Sergio Rubini, Francesco Cabras, Andrea Refuto, Giovanni Capalbo, Matt Patresi, Sabrina Impacciatore, Daniela Poti, Jarreth J. Merz, Noemi Marotta, Rossella Longo, Davide Marotta, Rosalinda Celentano, Danilo Di Ruzza, Vincenzo Monti, Danilo Maria Valli, Nuot Arquint, Abraam Fontana, Valerio Isidori, Paulo dos Santos, Arianna Vitolo, Gabriella Barbuti, Ornella Giusto, Michelle Bonev, Lucia Stara, Evelina Meghnagi, Francis Dokyi",3.4,127,A graphic portrayal of the last twelve hours of Jesus of Nazareth’s life.,https://a.ltrbxd.com/resized/sm/upload/fs/13/yr/8k/oFuLM1EaKhi1WNWiTjQ1HKIZ1Eg-0-230-0-345-crop.jpg?v=bd3dfc0232,https://letterboxd.com/film/the-passion-of-the-christ/
The Leopard,"Moonage Pictures, Indiana Production",2025,Drama,"Tom Shankland, Giuseppe Capotondi",N/A,"Kim Rossi Stuart, Benedetta Porcaroli, Saul Nanni, Deva Cassel, Paolo Calabresi, Astrid Meloni, Francesco Colella, Greta Esposito",N/A,N/A,"Amid the unification of 1860s Italy, a Sicilian prince grapples with the collision between his family’s ancient privilege and revolutionary change.",https://s.ltrbxd.com/static/img/empty-poster-230-nQeuntFa.png,https://letterboxd.com/film/the-leopard-2025/
Paint Drying,N/A,2016,N/A,Charlie Shackleton,Charlie Shackleton,N/A,N/A,607,10 hours of paint drying on a wall.,https://a.ltrbxd.com/resized/film-poster/1/0/8/0/3/4/2/1080342-paint-drying-0-230-0-345-crop.jpg?v=9611d1c3b1,https://letterboxd.com/film/paint-drying/
Senior Year,"Paramount Players, Broken Road Productions, Camp Sugar",2022,Comedy,Alex Hardcastle,"Chris Bender, Rebel Wilson, Todd Garner, Timothy M. Bourne","Rebel Wilson, Sam Richardson, Zoë Chao, Mary Holland, Justin Hartley, Chris Parnell, Angourie Rice, Molly Brown, Zaire Adams, Ana Yi Puig, Tyler Barnhardt, Jade Bender, Avantika, Joshua Colley, Jeremy Ray Taylor, Michael Cimino, Brandon Scott Jones, Tiffany Denise Hobbs, Lauren Halperin, Alicia Silverstone, Lucy Taylor, Merrick McCartha, Ruby Frankel, Steve Aoki, John Crow, Mimi Gould, Vance Kanell, Joel Ray Ishman, Vee Bhakta, Leonard R. Butler, James Millar, Darrell Snedeger, Alyssa Mae Clark",2.1,114,A thirty-seven-year-old woman wakes up from a twenty-year coma and returns to the high school where she was once a popular cheerleader to finish her senior year and become prom queen.,https://a.ltrbxd.com/resized/film-poster/7/1/8/2/9/5/718295-senior-year-0-230-0-345-crop.jpg?v=7c312d3d8e,https://letterboxd.com/film/senior-year-2022/
Working Girls,"Miramax, New York State Council on the Arts, The National Endowment for the Arts, The Jerome Foundation, Alternate Current",1986,Drama,Lizzie Borden,"Margaret Smilow, Andi Gladstone, Lizzie Borden","Louise Smith, Deborah Banks, Liz Caldwell, Marusia Zach, Amanda Goodwin, Boomer Tibbs, Eli Hasson, Tony Whiting, Richard M. Davidson, Ronald Willoughby, Paul Slimak, Fred Neumann, Patience Pierce, Ellen McElduff, Grant Wheaton, Richard Leacock, Martin Haber, Carla-Maria Sorey, Michael Holland, Dan Nuțu, Ron Manning, Fred Baker, Janne Peters, Norbert Brown, Helen Nicholas, Benjamin Egbuna, Chen Li, Raymond Moy, Yu Lu, Roger Babb, Saunder Finard",3.9,93,"A lesbian college graduate, trying to bankroll her own photography business, works as a high-priced New York City escort.",https://a.ltrbxd.com/resized/film-poster/7/9/5/6/2/79562-working-girls-0-230-0-345-crop.jpg?v=6a71733e95,https://letterboxd.com/film/working-girls-1986/
The Sacrifice,"Argos Films, Josephson & Nykvist HB, Sandrews, SVT, Film4 Productions",1986,Drama,Andrei Tarkovsky,Anna-Lena Wibom,"Erland Josephson, Susan Fleetwood, Allan Edwall, Guðrún Gísladóttir, Sven Wollter, Valérie Mairesse, Filippa Franzén, Tommy Kjellqvist, Per Källman, Tommy Nordahl, Tintin Anderzon, Jane Friedmann, Helena Brodin, Martin Lindström, Birgit Carlstén, Jan-Olof Strandberg, Christian Jarder",4.3,149,"Alexander, a journalist, philosopher and retired actor, celebrates a birthday with friends and family when it is announced that nuclear war has begun.",https://a.ltrbxd.com/resized/film-poster/3/6/6/1/8/36618-the-sacrifice-0-230-0-345-crop.jpg?v=abe0768e2a,https://letterboxd.com/film/the-sacrifice/
Penelope,"Summit Entertainment, Tatira-Hiller Productions, Grosvenor Park Media, Type A Films",2006,"Comedy, Fantasy, Romance",Mark Palansky,"Leslie Caveny, Jennifer Simpson, Reese Witherspoon, Phil Robertson, Scott Steindorff","Christina Ricci, James McAvoy, Catherine O'Hara, Reese Witherspoon, Peter Dinklage, Richard E. Grant, Simon Woods, Nigel Havers, Christina Greatrex, Michael Feast, Ronni Ancona, Richard Leaf, Lenny Henry, Nick Frost, Russell Brand, James Howard, Paul Viragh, Eve Pearce, Martin McDougall, Burn Gorman, Simon Chandler, Andrew Bailey, John Voce, Tallulah Evans, Pam Phillips, Shaun Parkes, Todd Boyce, Matt Rippy, Preston Nyman",3.2,103,"Forlorn heiress Penelope Wilhern is cursed, and the only way out is to fall in love with someone of suitable stock. But how can she find her soul mate when she’s sequestered inside her family’s estate with only her parents to keep her company. This untraditional fairy tale about a girl who bucks convention to create her own happy ending.",https://a.ltrbxd.com/resized/film-poster/4/7/9/3/8/47938-penelope-0-230-0-345-crop.jpg?v=477aa110f1,https://letterboxd.com/film/penelope/
Nanny McPhee,"Metro-Goldwyn-Mayer, Three Strange Angels, Nanny McPhee Productions, Working Title Films, StudioCanal, Universal Pictures",2005,"Family, Comedy, Fantasy",Kirk Jones,"Tim Bevan, Eric Fellner, Lindsay Doran, Glynis Murray","Emma Thompson, Colin Firth, Kelly Macdonald, Thomas Brodie-Sangster, Eliza Bennett, Jennifer Rae Daykin, Raphaël Coleman, Samuel Honywood, Holly Gibbs, Hebe Barnes, Zinnia Barnes, Angela Lansbury, Celia Imrie, Imelda Staunton, Elizabeth Berrington, Derek Jacobi, Patrick Barlow, Adam Godley, Claire Downes, Phyllida Law, Freya Fumic",3.3,97,"Widower Cedric Brown hires Nanny McPhee to care for his seven rambunctious children, who have chased away all previous nannies. Taunted by Simon and his siblings, Nanny McPhee uses mystical powers to instill discipline. And when the children’s great-aunt and benefactor, Lady Adelaide Stitch, threatens to separate the kids, the family pulls together under the guidance of Nanny McPhee.",https://a.ltrbxd.com/resized/film-poster/4/5/4/4/8/45448-nanny-mcphee-0-230-0-345-crop.jpg?v=cd15ee3c64,https://letterboxd.com/film/nanny-mcphee/
Mad Max 2,Kennedy Miller Productions,1981,"Action, Adventure, Science Fiction, Thriller",George Miller,Byron Kennedy,"Mel Gibson, Bruce Spence, Michael Preston, Max Phipps, Vernon Wells, Kjell Nilsson, Emil Minty, Virginia Hey, William Zappa, Arkie Whiteley, Steve J. Spears, Syd Heylen, Moira Claux, David Downer, David Slingsby, Kristoffer Greaves, Max Fairchild, Tyler Coppin, Jerry O'Sullivan, Tony Deary, Kathleen McKay, Guy Norris, Anne Jones, James McCardell, Harold Baigent, Stewart Finlay-McLennan, Joanne Samuel",3.9,96,"Max Rockatansky returns as the heroic loner who drives the dusty roads of a postapocalyptic Australian Outback in an unending search for gasoline. Arrayed against him and the other scraggly defendants of a fuel-depot encampment are the bizarre warriors commanded by the charismatic Lord Humungus, a violent leader whose scruples are as barren as the surrounding landscape.",https://a.ltrbxd.com/resized/film-poster/4/7/5/9/9/47599-mad-max-2-the-road-warrior-0-230-0-345-crop.jpg?v=59f8b765f3,https://letterboxd.com/film/mad-max-2/
Millennium Mambo,"Paradis Films, Orly Films, Sino Movie",2001,"Drama, Romance",Hou Hsiao-hsien,"Éric Heumann, Chu Tien-wen","Shu Qi, Jack Kao, Duan Chun-hao, Doze Niu Cheng-Tse, Jun Takeuchi, Yi-Hsuan Chen, Ko Takeuchi, Hsu Hui-Ni, Rio Peng, Pauline Chan Bo-Lin",3.9,106,Vicky recalls her romances with her exes Hao Hao and Jack in the neon-lit clubs of Taipei.,https://a.ltrbxd.com/resized/film-poster/4/5/1/9/5/45195-millennium-mambo-0-230-0-345-crop.jpg?v=0ef842bc87,https://letterboxd.com/film/millennium-mambo/
