Title,Studios,Year,Genre,Director,Producers,Cast,AvgRating,Duration,Description,Poster URL,Page URL
Idle Hands,"Licht/Mueller Film Corporation, Team Todd, Columbia Pictures, TriStar Pictures",1999,"Comedy, Thriller, Horror, Fantasy",Rodman Flender,"Suzanne Todd, Jeffrey Sudzin, Andrew Licht, Jennifer Todd","Devon Sawa, Seth Green, Elden Henson, Jessica Alba, Christopher Hart, Vivica A. Fox, Jack Noseworthy, Katie Wright, Sean Whalen, Nicholas Sadler, Fred Willard, Connie Ray, Steve Van Wormer, Kelly Monaco, Timothy Stack, Joey Slotnick, Tom DeLonge, Sabrina Lu, Kyle Gass, Mindy Sterling, Donna W. Scott, Randy Oglesby, Molly Maslin, Carl Gabriel Yorke, Dexter Holland, Greg K., Kevin ‘Noodles’ Wasserman, Ron Welty",3.2,92,"Anton is a cheerful but exceedingly non-ambitious 17-year-old stoner who lives to stay buzzed, watch TV, and moon over Molly, the beautiful girl who lives next door. However, it turns out that the old cliché about idle hands being the devil’s playground has a kernel of truth after all.",https://a.ltrbxd.com/resized/film-poster/4/8/2/5/9/48259-idle-hands-0-230-0-345-crop.jpg?v=e28a1c630d,https://letterboxd.com/film/idle-hands/
Last Year at Marienbad,"Cineriz, Cormoran Films, Silver Films, Argos Films, Cinétel, Terra Film, Precitel, Como Films, Les Films Tamara",1961,"Drama, Romance",Alain Resnais,"Raymond Froment, Pierre Courau, Anatole Dauman, Robert Dorfmann","Delphine Seyrig, Giorgio Albertazzi, Sacha Pitoëff, Françoise Bertin, Luce Garcia-Ville, Héléna Kornel, Françoise Spira, Karin Toche-Mittler, Pierre Barbaud, Wilhelm von Deek, Jean Lanier, Gérard Lorin, Davide Montemurri, Gilles Quéant, Gabriel Werner",4.1,95,"In a strange and isolated chateau, a man becomes acquainted with a woman and insists that they have met before.",https://a.ltrbxd.com/resized/film-poster/4/9/5/2/7/49527-last-year-at-marienbad-0-230-0-345-crop.jpg?v=4eb29745bd,https://letterboxd.com/film/last-year-at-marienbad/
Loveable,"Nordisk Film Norway, Amarcord",2024,"Romance, Drama",Lilja Ingolfsdottir,Thomas Robsahm,"Helga Guren, Oddgeir Thune, Heidi Gjermundsen, Marte Magnusdotter Solem, Elisabeth Sand, Maja Tothammer-Hruza, Kyrre Haugen Sydness, Esrom Kidane, Lucas Inversini, Aksel August Lenander-Lervik, Erik Love Aase Øfsdahl, Anna Lou Mamen, Victor Roll Nordstoga, Berthina Kayembe, Solveig Nesle Stang Haugland, Mona Grenne, Else Mariann Enger",3.8,103,"Maria finds herself at a crossroads when her husband suddenly announces that he wants to end their relationship. She must either let her whole world come crashing down, or come to terms with the life she has and find a way forward.",https://a.ltrbxd.com/resized/film-poster/9/7/6/1/8/0/976180-loveable-0-230-0-345-crop.jpg?v=ac88d913ae,https://letterboxd.com/film/loveable/
SuperTurnê: The First and Last Night,"Universal Music, UFO",2025,"Music, Documentary","Jão, Malu Alves",N/A,"Jão, Pedro Tófani, Zebu, Alana Alberg, André Jordão, Bira Junior, Diogo Duarte, Francine Móh, Francisco Martins, Jamah, Mariana Oliveira",4.1,158,"“SuperTurnê: The First and Last Night” has its grand premiere capturing unforgettable moments from one of the biggest tours in Brazilian history. Filmed at Allianz Parque in São Paulo, the material showcases the three sold-out shows performed by Jão, which brought over 140,000 people to the stadium, while also revealing behind-the-scenes footage of this unprecedented mega-production in Brazil.",https://a.ltrbxd.com/resized/film-poster/1/3/2/3/0/8/5/1323085-superturne-the-first-and-last-night-0-230-0-345-crop.jpg?v=3d0ca4f93b,https://letterboxd.com/film/superturne-the-first-and-last-night/
The Score,"Horseshoe Bay Productions, Paramount Pictures, Mandalay Pictures, StudioCanal, CP Medien, MP Film Management, Lions Gate Films, Lee Rich Productions",2001,"Action, Thriller, Crime, Drama, Mystery",Frank Oz,"Gary Foster, Lee Rich","Robert De Niro, Edward Norton, Marlon Brando, Angela Bassett, Gary Farmer, Jamie Harrold, Paul Soles, Martin Drainville, Serge Houde, Jean-René Ouellet, Claude Despins, Richard Waugh, Mark Camacho, Marie-Josée Colburn, Gavin Svensson, Thinh Truong Nguyen, Carlo Essagian, Christian Tessier, Lenie Scoffié, Bobby Brown, Maurice Demers, Christian Jacques, Henry Farmer, Dacky Thermidor, Gerard Blouin, Charles V. Doucet, Pierre Drolet, Norman Mikeal Berketa, Eric Hoziel, John Talbot, Richard Zeman, Nick Carasoulis, Cassandra Wilson, Mose Allison, Lisa Marie Blair, Bill Haughland, Roger L. Jackson, David L. McCallum, Lonnie Plaxico, Christine Solomon, Angelo Tsarouchas, Andrew W. Walker",3.2,124,An aging thief hopes to retire and live off his ill-gotten wealth when a young kid convinces him into doing one last heist.,https://a.ltrbxd.com/resized/film-poster/4/5/3/6/3/45363-the-score-0-230-0-345-crop.jpg?v=364708f53f,https://letterboxd.com/film/the-score/
Tie Me Up! Tie Me Down!,El Deseo,1989,"Romance, Drama, Comedy",Pedro Almodóvar,Enrique Posner,"Victoria Abril, Antonio Banderas, Loles León, María Barranco, Rossy de Palma, Julieta Serrano, Francisco Rabal, Lola Cardona, Montse G. Romeu, Emiliano Redondo, Oswaldo Delgado, Concha Rabal, Alberto Fernández, José María Tasso, Angelina Llongueras, Manuel Bandera, Virginia Díez, Juana Cordero, Francisca Caballero, Francisca Pajuelo, Víctor Coyote, Carlos García Cambero, Alito Rodgers, Tamaki, Malena Gracia, Agustín Almodóvar, Rodolfo Montero, Miguel García, Pedro Losada",N/A,102,"Recently released from a mental hospital, Ricky ties up Marina, a film star he once had sex with and keeps her hostage.",https://s.ltrbxd.com/static/img/empty-poster-230-nQeuntFa.png,https://letterboxd.com/film/tie-me-up-tie-me-down/
The Void,"XYZ Films, 120dB Films, JoBro Productions, Cave Painting Pictures, The Salt Company",2016,"Horror, Science Fiction, Mystery","Steven Kostanski, Jeremy Gillespie","Jonathan Bronfman, Casey Walker","Aaron Poole, Kathleen Munroe, Art Hindle, Daniel Fathers, Kenneth Welsh, Ellen Wong, Stephanie Belding, Mik Byskov, Grace Munro, James Millington, Evan Stern, Trish Rainone, Amy Groening, Matthew Kennedy, Chris Nash, Deke Garner",3.0,90,"In the middle of a routine patrol, officer Daniel Carter happens upon a blood-soaked figure limping down a deserted stretch of road. He rushes the young man to a nearby rural hospital staffed by a skeleton crew, only to discover that patients and personnel are transforming into something inhuman. As the horror intensifies, Carter leads the other survivors on a hellish voyage into the subterranean depths of the hospital in a desperate bid to end the nightmare before it’s too late. ×",https://a.ltrbxd.com/resized/sm/upload/iv/ll/2e/5y/93v6aVNJCA78dfN2kbDq8dLrOSL-0-230-0-345-crop.jpg?v=74d1584915,https://letterboxd.com/film/the-void-2016/
The Happening,"Spyglass Entertainment, Blinding Edge Pictures, UTV Motion Pictures, 20th Century Fox, Dune Entertainment III",2008,"Thriller, Science Fiction, Horror",M. Night Shyamalan,"Jose L. Rodriguez, Barry Mendel, Deven Khote, Sam Mercer, M. Night Shyamalan, John Rusk, Les G. Jones","Mark Wahlberg, Zooey Deschanel, John Leguizamo, Ashlyn Sanchez, Betty Buckley, Spencer Breslin, Robert Bailey Jr., Frank Collison, Jeremy Strong, Alan Ruck, Victoria Clark, M. Night Shyamalan, Alison Folland, Kristen Connolly, Cornell Womack, Curtis McClarin, Robert Lenzi, Derege Harding, Roberto Lombardi, Kerry O'Malley, Shayna Levine, Stéphane Debac, Cyrille Thouvenin, Babita Hariani, Alicia Taylor, Edward James Hyland, Armand Schultz, Stephen Singer, Sophia Burke, Alex Van Kooy, Charlie Saxton, Kathy Hart, Lisa Furst, Rick Foster, Marc H. Glick, Don Castro, Bill Chemerka, Jann Ellis, Whitney Sugarman, Mary Ellen Driscoll, Greg Wood, Peter Appel, Eoin O'Shea, Michael Quinlan, Lyman Chen, Brian O'Halloran, Megan Grace, Rich Chew, Keith Bullard, Joel de la Fuente, Ashley Brimfield, Mara Hobel, James Breen, Carmen Bitonti, Brian Anthony Wilson, Greg SmithAldridge, Ukee Washington, John Ottavino, Sid Doherty, Wes Heywood, Nancy Sokerka, Julia Yorks, Bill Shusta, Kirk Penberthy, Alex Craft, Allie Habberstad, Alex Harz, Adam Schoon, Lee Squire, Robert Bizik",2.1,90,"When a deadly airborne virus threatens to wipe out the northeastern United States, teacher Elliot Moore and his wife Alma flee from contaminated cities into the countryside in a fight to discover the truth. Is it terrorism, the accidental release of some toxic military bio weapon – or something even more sinister?",https://a.ltrbxd.com/resized/film-poster/4/7/6/6/8/47668-the-happening-0-230-0-345-crop.jpg?v=df23462c8e,https://letterboxd.com/film/the-happening/
Happy as Lazzaro,"Ad Vitam Production, Tempesta, Amka Films, Pola Pandora Filmproduktions, KNM, RAI Cinema, RSI, ARTE France Cinéma, ZDF/Arte",2018,"Drama, Fantasy",Alice Rohrwacher,"Carlo Cresto-Dina, Paolo Del Brocco, Gregory Gajos, Viola Fügen, Pierre-François Piet, Alessio Lazzareschi, Olivier Père, Michael Weber, Tiziana Soudani, Michel Merkt, Cécile Tollu-Polonowski, Meinolf Zurhorst","Adriano Tardiolo, Agnese Graziani, Luke Chikovani, Alba Rohrwacher, Sergi López, Tommaso Ragno, Natalino Balasso, Nicoletta Braschi, Carlo Massimino, Daria Pascal Attolini, Maddalena Baiocco, Giulia Caccavello, Annunziata Capretto, Alessandro Genovesi, Davide Denci, Edoardo Montalto, Leonardo Nigro, Gala Othero Winter, Iris Pulvano, Ettore Scarpa, Pasqualina Scuncia, Carlo Tarmati, Pascal Tréguy, Daria Deflorian, Elisabetta Rocchetti, Luciano Vergaro, Annibale De Luca, Giuseppe Corsini, Marcello Duranti, Marco Donno, Nicola Sorci, Sofia Stangherlin, Silvia Lucarini, Cinzia de Luca, Lucia Centoscudi, Anita Crucitti, David Bennent, Antonio Salines",4.0,128,"Purehearted teen Lazzaro is content living as a sharecropper in rural Italy, but an unlikely friendship with the marquise’s son will change his world.",https://a.ltrbxd.com/resized/film-poster/4/1/2/4/3/3/412433-happy-as-lazzaro-0-230-0-345-crop.jpg?v=2bfeaaf301,https://letterboxd.com/film/happy-as-lazzaro/
Sweet Smell of Success,"Hecht-Hill-Lancaster Productions, United Artists, Norma Productions, Curtleigh Productions",1957,Drama,Alexander Mackendrick,James Hill,"Burt Lancaster, Tony Curtis, Susan Harrison, Martin Milner, Jeff Donnell, Sam Levene, Joe Frisco, Barbara Nichols, Emile Meyer, Edith Atwater, Chico Hamilton, Paul Horn, Fred Katz, Buddy Clark, Jay Adler, Mary Bayless, Nicky Blair, Nick Borgani, Ralph Brooks, Brad Brown, Steve Carruthers, Robert Carson, Lewis Charles, Dick Cherney, Paul Cristo, Joe Di Reda, Lawrence Dobkin, Tom Ferrandini, John Fiedler, Bess Flowers, William Forrest, Joseph Forte, Raoul Freeman, Kay Garrett, Joe Gray, Marion Gray, James Hill, Charles Jordan, Colin Kenny, Joseph La Cava, Mike Lally, Joseph Leon, King Lockwood, Thomas Martin, Hans Moebus, King Mojave, Sol Murgi, Forbes Murray, George Nardelli, William H. O'Brien, Clifford Odets, Charles Perry, Bill Raisch, Waclaw Rekwart, Edward Rickard, Jane Ross, Autumn Russell, Charles Sherlock, Carson Smith, Queenie Smith, Bert Stevens, Arthur Tovey, James Turley, Lurene Tuttle, Harry Tyler, Philip Van Zandt, George Washburn, David White, H.M. Wynant",4.2,97,"New York City newspaper writer J.J. Hunsecker holds considerable sway over public opinion with his Broadway column, but one thing that he can’t control is his younger sister, Susan, who is in a relationship with aspiring jazz guitarist Steve Dallas. Hunsecker strongly disapproves of the romance and recruits publicist Sidney Falco to find a way to split the couple, no matter how ruthless the method.",https://a.ltrbxd.com/resized/film-poster/5/1/1/9/3/51193-sweet-smell-of-success-0-230-0-345-crop.jpg?v=deaf2cf343,https://letterboxd.com/film/sweet-smell-of-success/
The Last Temptation of Christ,"Universal Pictures, Cineplex-Odeon Films",1988,Drama,Martin Scorsese,Barbara De Fina,"Willem Dafoe, Harvey Keitel, Paul Greco, Steve Shill, Verna Bloom, Barbara Hershey, Roberts Blossom, Barry Miller, Gary Basaraba, Irvin Kershner, Victor Argo, Michael Been, Paul Herman, John Lurie, Leo Burmester, Andre Gregory, Peggy Gormley, Randy Danson, Robert Spafford, Doris von Thury, Tomas Arana, Alan Rosenberg, Del Russel, Nehemiah Persoff, Donald Hodson, Harry Dean Stanton, Peter Berling, David Bowie, Juliette Caton, Mohammed Mabsout, Ahmed Nacir, Mokhtar Salouf, Mahamed Ait Fdil Ahmed, Russel Case, Mary Sellers, Donna Magnani, Penny Brown, Gabi Ford, Dale Wyatt, Domenico Fiore, Ted Rusoff, Leo Damian, Robert Laconi, Jonathan Zhivago, Illeana Douglas, D.J. Sharp, Khalid Benghrib, Redouane Farhane, Fabienne Panciatili, Naima Skikes, Souad Rahal, Otmane Chbani Idrissi, Jamal Belkhayat, Giovanni Cianfriglia, Martin Scorsese",3.9,163,"Jesus, a humble Judean carpenter beginning to see that he is the son of God, is drawn into revolutionary action against the Roman occupiers by Judas – despite his protestations that love, not violence, is the path to salvation. The burden of being the savior of mankind torments Jesus throughout his life, leading him to doubt.",https://a.ltrbxd.com/resized/film-poster/4/5/6/5/2/45652-the-last-temptation-of-christ-0-230-0-345-crop.jpg?v=bc15d11cd8,https://letterboxd.com/film/the-last-temptation-of-christ/
The Hitman's Bodyguard,"Campbell Grobman Films, East Light Media, Nu Boyana Film Studios, Tom de Mol Productions, Summit Entertainment, Millennium Media, Davis Films, Cristal Pictures, Lionsgate, TIK Films",2017,"Thriller, Comedy, Action, Crime",Patrick Hughes,"Les Weldon, William Paul Clark, David Ellison","Ryan Reynolds, Samuel L. Jackson, Gary Oldman, Salma Hayek Pinault, Elodie Yung, Richard E. Grant, Joaquim de Almeida, Kirsty Mitchell, Yuri Kolokolnikov, Sam Hazeldine, Mikhail Gorevoy, Barry Atsma, Georgie Glen, Tine Joustra, Joséphine de la Baume, Rod Hallett, Abbey Hoes, Ori Pfeffer, Lee Nicholas Harris, Nadia Konakchieva, Noortje Herlaar, Chris Brazier, Alan McKenna, Donna Preston, Nikolay Stanoev, Renars Latkovskis, Samantha Bolter, Alexander Mercury, Russell De Rozario, Antoin Cox, Nicolas de Pruyssenaere, Mounir Margoum, Velimir Velev, Bruno Salgueiro, Marko Mandić, Vladimir Vladimirov, Zlatka Raikova, Hristo Petkov, Stilyan Mavrov, Ulyana Chan, Ilian Emanviov, Chris Wilson, Stuart Whelan, Atul Sharma, Tamara Sharpe, Bharat Mistri, Halima Nagori, Truus de Boer, Mark Christopher Collins, Ivan Kostadinov, Patrick Hughes, Sander Jan Klerk, Alexander Terentyev",3.1,118,"The world’s top bodyguard gets a new client, a hitman who must testify at the International Court of Justice. They must put their differences aside and work together to make it to the trial on time.",https://a.ltrbxd.com/resized/sm/upload/cs/4h/d7/ej/5CGjlz2vyBhW5xHW4eNOZIdgzYq-0-230-0-345-crop.jpg?v=aa8431110a,https://letterboxd.com/film/the-hitmans-bodyguard/
The Company of Wolves,"ITC Entertainment, Palace Pictures",1984,"Fantasy, Horror",Neil Jordan,"Stephen Woolley, Chris Brown","Sarah Patterson, Angela Lansbury, David Warner, Graham Crowden, Brian Glover, Kathryn Pogson, Stephen Rea, Tusse Silberg, Micha Bergese, Georgia Slowe, Susan Porrett, Shane Johnstone, Dawn Archibald, Richard Morant, Danielle Dax, Vincent McClaren, Ruby Buchanan, Jimmy Gardner, Roy Evans, Edward Marksen, Jim Brown, Jim Carter, Terence Stamp",3.4,95,"An adaptation of Angela Carter’s fairy tales. Young Rosaleen dreams of a village in the dark woods, where Granny tells her cautionary tales in which innocent maidens are tempted by wolves who are hairy on the inside. As Rosaleen grows into womanhood, will the wolves come for her too?",https://a.ltrbxd.com/resized/film-poster/4/4/9/0/1/44901-the-company-of-wolves-0-230-0-345-crop.jpg?v=986afa7914,https://letterboxd.com/film/the-company-of-wolves/
The Pacifier,"Walt Disney Pictures, Spyglass Entertainment",2005,"Family, Comedy, Action",Adam Shankman,"Gary Barber, Roger Birnbaum, Jonathan Glickman","Vin Diesel, Lauren Graham, Faith Ford, Brittany Snow, Max Thieriot, Chris Potter, Carol Kane, Brad Garrett, Morgan York, Tate Donovan, Scott Thompson, Denis Akiyama, Mung-Ling Tsui, Anne Fletcher, Allison Lynn, Gabriel Antonacci, Mary Pitt, Dan Sutcliffe, Vanessa Cobham, Jordan Allison, Rachael Dolan, Charlotte Szivak, Toya Alexis, Valerie Boyle, Karla Jang, Silver Kim, Robert Yeretch, Scott Hurst, Christie Allaire, Stephanie Allaire, Amy Allicock, Helena Chow, Joella Crichton, Laura Jeanes, Rebecca Priestley, Taryn Ash, Catherine Burdon, Shane Cardwell, Tommy Chang, Alexander Conti, David Lipper, Tig Fong, Maria Georgas, Nikki Shah, Jordan Todosey, Emi Yaguchi-Chow, Demetrius Joyette, Christopher Lortie, Sotiri Georgas, Steven Georgas, Gannon Racki, Seth Howard, Marcus Hutchings, David Sparrow, Evelyn Kaye, Christian Laurin, John MacDonald, Billy Oliver, Curtis Parker, Matt Purdy, Jean Pearson, Kyle Schmid, Robert Thomas, Michael Quintero, Cameron Hickox, Cade Courtley, Cassius M. Willis, Jeff Podgurski, F. Valentino Morales, Hank Amos, Charles Haugk, Scott Reiff, Darryl Dinn, Christopher Giroux, Adam Shankman, Gary Scott Thompson, Khristian Lupo",2.6,95,Navy SEAL Shane Wolfe is handed a new assignment: Protect the five Plummer kids from enemies of their recently deceased father – a government scientist whose top-secret experiment remains hidden in the kids’ house.,https://a.ltrbxd.com/resized/film-poster/4/6/6/2/0/46620-the-pacifier-0-230-0-345-crop.jpg?v=edc28fce86,https://letterboxd.com/film/the-pacifier/
The Hunger,"Metro-Goldwyn-Mayer, The Richard Shepherd Company",1983,"Drama, Horror",Tony Scott,Richard Shepherd,"Catherine Deneuve, David Bowie, Susan Sarandon, Cliff DeYoung, Beth Ehlers, Dan Hedaya, Rufus Collins, Suzanne Bertish, James Aubrey, Ann Magnuson, John Stephen Hill, Shane Rimmer, Peter Murphy, Douglas Lambert, Bessie Love, John Pankow, Willem Dafoe, Sophie Ward, Philip Sayer, Lise Hilboldt, Michael Howe, Edward Wiley, Richard Robles, George Camiller, Oke Wambu, Kent Miller, Fred Yockers, Susan Hunter, James Wassenich, Allan Richards, Hilary Six, Carole-Ann Scott, Howard Blake, Darrell Brook, Jane Leeves, Derek Lyons, James Payne",3.6,96,"Five-thousand-year-old vampire Miriam promises her lovers the gift of eternal life. When John, her cellist companion for centuries, discovers that he has suddenly begun growing old, he attempts to seek out the help of Dr. Sarah Roberts, a researcher on the mechanisms of aging.",https://a.ltrbxd.com/resized/film-poster/4/5/0/9/9/45099-the-hunger-0-230-0-345-crop.jpg?v=00ecc49c58,https://letterboxd.com/film/the-hunger/
Tenacious D in The Pick of Destiny,"New Line Cinema, Red Hour",2006,"Adventure, Fantasy, Comedy, Music",Liam Lynch,"Kyle Gass, Jack Black, Stuart Cornfeld","Jack Black, Kyle Gass, JR Reed, Ronnie James Dio, Paul F. Tompkins, Troy Gentile, Ned Bellamy, Fred Armisen, Kirk Ward, Amy Poehler, Tim Robbins, Dave Grohl, Ben Stiller, Lara Everly, Brittany Eldridge, Melissa-Anne Davenport, John Ennis, Vincent Foster, Jay Johnston, Colin Hanks, Stephanie Erb, Amy Adams, Milos Milicevic, Molly Bryant, Michael Rivkin, Gregg Turkington, Patrick M. Walsh, Bevin Kaye, Evie Peck, Mason Knight, Erik Walker, Cynthia Ettinger, Andrew Lewis Caldwell, Laura Milligan, Jason Segel, Meat Loaf, John C. Reilly",3.5,93,"In Venice Beach, naive Midwesterner JB bonds with local slacker KG and they form the rock band Tenacious D. Setting out to become the world’s greatest band is no easy feat, so they set out to steal what could be the answer to their prayers… a magical guitar pick housed in a rock-and-roll museum some 300 miles away.",https://a.ltrbxd.com/resized/film-poster/5/0/4/5/8/50458-tenacious-d-in-the-pick-of-destiny-0-230-0-345-crop.jpg?v=1884441e24,https://letterboxd.com/film/tenacious-d-in-the-pick-of-destiny/
Liverleaf,"Nikkatsu Corporation, Nippan Group Holdings, VAP, L'espace Vision, L'ESPACE FILM",2018,"Drama, Thriller, Horror",Eisuke Naito,N/A,"Anna Yamada, Hiroya Shimizu, Rinka Otani, Rena Ohtsuka, Seina Nakata, Ayaka Konno, Arisa Sakura, Kenshin Endo, Kazuki Ōtomo, Masato Endo, Aki Morita, Masahiro Toda, Sena Tamayori, Reiko Kataoka, Minori Terada, Hiroshi Kobayashi",3.2,114,"The story follows Nozaki Haruka, a middle school student who transfers to a new school in a small town because of her father’s work. Unfortunately, she becomes a victim of horrific bullying, but since the school will be closing in 2 months after graduation, no one is willing to help her.",https://a.ltrbxd.com/resized/film-poster/4/2/8/8/5/0/428850-liverleaf-0-230-0-345-crop.jpg?v=6f59d296e7,https://letterboxd.com/film/liverleaf/
Four Days in September,"Miramax, Columbia TriStar",1997,"Drama, Thriller, History",Bruno Barreto,"Luiz Carlos Barreto, Lucy Barreto, Mary Ann Braubach","Alan Arkin, Pedro Cardoso, Fernanda Torres, Luiz Fernando Guimarães, Cláudia Abreu, Nelson Dantas, Matheus Nachtergaele, Marco Ricca, Maurício Gonçalves, Caio Junqueira, Selton Mello, Eduardo Moscovis, Waldir Onofre, Samir Murad, Charles Myara, Harry Stone, Fernanda Montenegro, Milton Gonçalves, Othon Bastos, Lulu Santos, Alessandra Negrini, Jorge Cherques, Antonio Pedro, Flávio São Thiago, Luiz Armando Queiroz, Caroline Kava, Fisher Stevens",3.7,110,"Fernando, a journalist, and his friend César join terrorist group MR8 in order to fight Brazilian dictatorial regime during the late sixties. César, however, is wounded and captured during a bank hold up. Fernando then decides to kidnap the American ambassador in Brazil and ask for the release of fifteen political prisoners in exchange for his life.",https://a.ltrbxd.com/resized/film-poster/3/8/5/2/1/38521-four-days-in-september-0-230-0-345-crop.jpg?v=aec2878a0c,https://letterboxd.com/film/four-days-in-september/
Barbie: A Fashion Fairytale,"Mattel, Evolution Films",2010,"Family, Animation",William Lau,"Kylie Ellis, Shelley Tabbut, Shawn McCorkindale","Diana Kaarina, Adrian Petriw, Tabitha St. Germain, Patricia Drake, Alexa Devine, Shannon Chan-Kent, Maryke Hendrikse, Kandyse McClure, Britt Irvin, Chiara Zanni, Kelly Metzger, Andrea Libman, Brandy Kopp, Charles Fathy, Annick Obonsawin, Nicole Bouma, Nicole Oliver, Vincent Tong, Cathy Weseluck, Peter New, Peter Kelamis, Michael Dobson, France Perras",3.8,79,"Join Barbie in a colourful, modern-day fairytale filled with fashion, friends and fun! Barbie and her dog Sequin jet off to visit her Aunt’s amazing fashion house in Paris, and much to her surprise it’s about to be shut down forever. After she discovers three enchanting Flairies with sparkle-magic powers, Barbie comes up with a brilliant idea to save the business. She even inspires Alice, a shy fashion designer, and together they create a dazzling runway fashion show. Barbie shows that magic happens when you believe in yourself. ×",https://a.ltrbxd.com/resized/film-poster/2/0/3/2/7/20327-barbie-a-fashion-fairytale-0-230-0-345-crop.jpg?v=bd444c4062,https://letterboxd.com/film/barbie-a-fashion-fairytale/
Azrael,"C2 Motion Picture Group, Homeless Bob Production, Traffic.",2024,"Thriller, Action, Horror",E.L. Katz,"Simon Barrett, Dan Kagan, Dave Caplan, Isaac Bauman","Samara Weaving, Vic Carmen Sonne, Katariina Unt, Peter Christoffersen, Nathan Stewart-Jarrett, Johhan Rosenberg, Eero Milonoff, Sebastian Bull Sarning, Rea Lest, Phong Giang, Sonia Roszczuk, Valentin Tzin, Vincent Willestrand, Karen Bengo, Felix Leech, Ekke Märten Hekles, Robin Liksor, Karl Edgar Tammi, Boyan Anev, Roger Purtsak, Edgar Rahhimov, Marten Frank, Jan-Erik Sedrik, Elvira Erli, Kaire Sõmer, Eliisabet Estrid Somer, Alisa Merkurieva, Andreas Ainjärv, Anne Türnpu, Christopher Das Raaj, Claudia Isabel Lopez Ortiz, Daniel Amanyo, Dmitry Merkuriev, Ege Berk Akgün, Ene Pappel, Helin Rääk, Janek Karakatš, Jegor Sevastjanov, Jekaterina Meinert, Johanna Vaiksoo, Jörgen Liik, Klaus Abram Siimon, Konstantin Aleksejev, Lenna Lii Kuuskla, Liis Maria Kaabel, Lisette Malla, Maarja Tammemägi, Madis Laur, Marion Tammet, Martin Köstner, Meelis Rämmeld, Mia Moore, Priit Kesa, Reena Uusmets, Sergei Pozdniakov, Silva Pijon, Silver Soorsk, Sirelyn Rääk, Sofia Kruusamägi, Stefan Hein, Vivek Tyagi",2.9,86,"In a world where no one speaks, a devout female hunts down a young woman who has escaped her imprisonment. Recaptured by its ruthless leaders, Azrael is due to be sacrificed to pacify an ancient evil deep within the surrounding wilderness.",https://a.ltrbxd.com/resized/film-poster/9/2/7/6/2/4/927624-azrael-0-230-0-345-crop.jpg?v=efb1d0614d,https://letterboxd.com/film/azrael-2024/
[REC]²,"Filmax, Castelao Productions, Canal+ España, TVE, ICO",2009,"Horror, Thriller","Jaume Balagueró, Paco Plaza",Julio Fernández,"Manuela Velasco, Jonathan D. Mellor, Óscar Zafra, Ariel Casas, Alejandro Casaseca, Pablo Rosso, Rafa Parra, Pep Molina, Andrea Ros, Àlex Batllori, Pau Poch, Juli Fàbregas, Ferrán Terraza, Claudia Silva, Martha Carbonell, Jorge-Yamam Serrano, Ana Isabel Velásquez, Carlos Lasarte, Kao Chenmin, Akemi Goto, David Vert, Carlos Olalla, Anna García Cuartero, Héctor Vidales, Lazzaro E. Oertli Ortiz, Alex Lameiro Blanch, Joan Hostench Martínez, Oscar Foronda, Javier Botet, Paco Plaza, Jaume Balagueró, Laura Díez Mora, Pere Vall, Marga Villalonga, Gerard Espert",3.2,84,"The action continues from [REC], with the medical officer and a SWAT team outfitted with video cameras are sent into the sealed off apartment to control the situation.",https://a.ltrbxd.com/resized/sm/upload/xd/n3/o5/mv/g2Dk8ud1KpXt2RWzvcgsuuPkPuJ-0-230-0-345-crop.jpg?v=722b1214ba,https://letterboxd.com/film/rec-2/
