Title,Studios,Year,Genre,Director,Producers,Cast,AvgRating,Duration,Description,Poster URL,Page URL
Sweet Home,"Studio N, Studio Dragon",2020,"Horror, the undead and monster classics, Sci-fi horror, creatures, and aliens, Survival horror and zombie carnage, Bloody vampire horror, Gory, gruesome, and slasher horror, Twisted dark psychological thriller, Show All…",N/A,N/A,"Song Kang, Lee Jin-uk, Lee Si-young, Jung Jin-young, Lee Do-hyun, Go Min-si, Yu Oh-seong, Oh Jung-se, Kim Moo-yul, Kim Si-a, Chae Won-been, Kim Ji-an, Yang Hye-ji, Heo Nam-jun",3.7,N/A,"As humans turn into savage monsters and the world plunges into terror, a handful of survivors fight for their lives — and to hold on to their humanity.",https://a.ltrbxd.com/resized/film-poster/7/3/5/0/9/9/735099-sweet-home-0-230-0-345-crop.jpg?v=0a69ad69c1,https://letterboxd.com/film/sweet-home-2020/
Tell It to the Bees,"Taking a Line for a Walk Productions, Riverstone Pictures, Archface Films, Cayenne Film Company, Reliance Entertainment Productions 8",2018,"Romance, Drama",Annabel Jankel,"Nik Bower, Nick Hill, Daisy Allsop, Annabel Jankel, Sean Wheelan, Laure Vaysse, Anthony Muir, Hannah Leader","Anna Paquin, Holliday Grainger, Emun Elliott, Steven Robertson, Lauren Lyle, Gregor Selkirk, Kate Dickie, Billy Boyd, Euan Mason, Zara Howell, Violet Fluendy, Kaidon McGrath, Liam Meghan, Joanne Gallagher, Joni Samson, Isaac Jenkins, Farah Samson, Leo Hoyte-Egan, Sarah McCardie, Alexa Snell, Michael O'Connor, Rebecca Hanssen, Tori Burgess, Kyle Fitzpatrick, Ruaridh Mollica, Craig O'Hara, Ben Bradley, Declan Gemmell, Penny Sharp, Lauren Boyle",3.2,106,"Dr. Jean Markham returns to the town she left as a teenager to take over her late father’s medical practice. When a school-yard scuffle lands Charlie in her surgery, she invites him to visit the hives in her garden and tell his secrets to the bees, as she once did. The new friendship between the boy and the bee keeper brings his mother Lydia into Jean’s world.",https://a.ltrbxd.com/resized/film-poster/4/0/7/0/8/1/407081-tell-it-to-the-bees-0-230-0-345-crop.jpg?v=8254a8be55,https://letterboxd.com/film/tell-it-to-the-bees/
All Dogs Go to Heaven,"Goldcrest, Don Bluth Entertainment, Don Bluth Ireland",1989,"Family, Fantasy, Drama, Animation, Comedy",Don Bluth,"Don Bluth, Gary Goldman, John Pomeroy","Burt Reynolds, Dom DeLuise, Judith Barsi, Melba Moore, Daryl Gilley, Candy Devine, Charles Nelson Reilly, Vic Tayback, Rob Fuller, Earleen Carey, Anna Manahan, Nigel Pegram, Loni Anderson, Ken Page, Godfrey Quigley, Jay Stevens, Dan Molina, Dan Kuenster, Mark Swan, David N. Weiss, Dick Zondag, Taylor Swanson, Jack Angel, Nancy Cartwright, Patrick Pinney",3.5,84,"When a casino-owning dog named Charlie is murdered by his rival Carface, he finds himself in Heaven basically by default since all dogs go to heaven. However, since he wants to get back at his killer, he cons his way back to the living with the warning that doing that damns him to Hell. Once back, he teams with his old partner, Itchy, to prep his retaliation. He also stumbles onto an orphan girl who can talk to the animals, thus allowing him to get the inside info on the races to ensure his wins to finance his plans. However, all the while, he is still haunted by nightmares of what’s waiting for him on the other side unless he can prove that he is worthy of Heaven again. ×",https://a.ltrbxd.com/resized/film-poster/4/5/2/5/0/45250-all-dogs-go-to-heaven-0-230-0-345-crop.jpg?v=0a33939636,https://letterboxd.com/film/all-dogs-go-to-heaven/
Black Mirror: Mazey Day,N/A,2023,"Thriller, Science Fiction, Horror, TV Movie",Uta Briesewitz,"Chio Del Olmo, Georgina Lowe","Zazie Beetz, Clara Rugaard, Danny Ramirez, Robbie Tann, James P. Rees, David Rysdahl, Jack Bandeira, Corey Johnson, Kenneth Collard, Charles Hagerty, Patrick Toomey, Marieta Sánchez, Yoojin Lee, Lucía Pemán, Marta Castellví, Alex Britt, Julio Perillán, Gary Anthony Stennette",2.1,40,A troubled starlet is dogged by invasive paparazzi while dealing with the consequences of a hit-and-run incident.,https://a.ltrbxd.com/resized/sm/upload/sn/u6/73/0i/BlackMirror-MazeyDay_2-0-230-0-345-crop.jpg?v=25e93e0750,https://letterboxd.com/film/black-mirror-mazey-day/
And Then We Danced,"French Quarter Film AB, Takes Film, AMA Productions, RMV Film, Inland Film, SVT, Svenska Filminstitutet, L'Aide aux Cinémas du Monde, La Région Île-de-France, The Swedish Arts Grants Committee",2019,"Romance, Drama",Levan Akin,"Mattias J. Skoglund, Mathilde Dedye, Ketie Danelia, Isabella Rodriguez, Julien Féret","Levan Gelbakhiani, Bachi Valishvili, Ana Javakishvili, Giorgi Tsereteli, Tamar Bukhnikashvili, Kakha Gogidze, Ninutsa Gabisonia, Aleko Begalishvili, Mate Khidasheli, Anano Makharadze, Marika Gogichaishvili, Levan Gabrava, Saba Abashidze, Soso Abramashvili, Tamar Skhirtladze",4.1,113,"A passionate coming-of-age tale set amidst the conservative confines of modern Tbilisi, the film follows Merab, a competitive dancer who is thrown off balance by the arrival of Irakli, a fellow male dancer with a rebellious streak.",https://a.ltrbxd.com/resized/film-poster/5/2/4/4/0/9/524409-and-then-we-danced-0-230-0-345-crop.jpg?v=352da26311,https://letterboxd.com/film/and-then-we-danced/
The Expendables,"Nimar Studios, Rogue Marble, Millennium Media, Nu Image, Lionsgate",2010,"Adventure, Action, Thriller",Sylvester Stallone,"Kevin King Templeton, John Thompson, Avi Lerner","Sylvester Stallone, Jason Statham, Jet Li, Dolph Lundgren, Eric Roberts, Randy Couture, Steve Austin, David Zayas, Giselle Itié, Charisma Carpenter, Gary Daniels, Terry Crews, Mickey Rourke, Hank Amos, Amin Joseph, Grifon Aldren, Antonio Rodrigo Nogueira, Antônio Rogério Nogueira, Sassa Nacimento, R.A. Rondell, Tze Yep, Precious Jenkins, Ronn Surels, Lauren Jones, Prazeres Barbosa, Jose Vasquez, Daniel Arrias, Antonio Gullo, Javier Lambert, Tatsu Carvalho, Marcio Rosario, Paulo Bastos, John Baran, Joshua Cardenez, Rod Carvalho, Gino Galento, Gideon Hodge, Victor Eli Hugo, James Landry Hébert, Topher Jones, Cody Juneau, Shadoe Knight, Everton Lawrence, Ace LeBleu, Edgar Leza, David Joseph Martinez, Aaron Saxton, Bruce Willis, Arnold Schwarzenegger, Victor Eli Hugo, Kadrolsha Ona Carole, Paulo Gustavo, Ricardo Vargas",2.7,103,"Barney Ross leads a band of highly skilled mercenaries including knife enthusiast Lee Christmas, a martial arts expert Yin Yang, heavy weapons specialist Hale Caesar, demolitionist Toll Road, and a loose-cannon sniper Gunner Jensen. When the group is commissioned by the mysterious Mr. Church to assassinate the dictator of a small South American island, Barney and Lee visit the remote locale to scout out their opposition and discover the true nature of the conflict engulfing the city. ×",https://a.ltrbxd.com/resized/film-poster/3/4/3/9/5/34395-the-expendables-0-230-0-345-crop.jpg?v=af8a3ef1e8,https://letterboxd.com/film/the-expendables/
The Bay,"Baltimore Pictures, Hydraulx, Automatik Entertainment, Haunted Movies",2012,"Thriller, Horror, Science Fiction",Barry Levinson,"Jason Blum, Barry Levinson, Oren Peli, Steven Schneider","Kristen Connolly, Will Rogers, Michael Beasley, Christopher Denham, Kenny Alfonso, Kether Donohue, Anthony Reynolds, Frank Deal, Kimberly Campbell, Lamya Jezek, Lucia Scarano, Nansi Aluka, Stephen Kunken, Beckett Clayton-Luce, Dave Hager, Tara Polhemus, Stacy Rabon, Justin Welborn, Jack Landry, Robert C. Treveiler, Brandon Hanson, Heidi Lawson, Jody Thompson, Andy Stahl, Zoe Clarke, Wyatt Hays, Brandon O'Dell, John Harrington Bland, James Patrick Freetly, Alisa Harris, Truman Brothers, Tim Parati, Bridget Gethins, Sue Plassmann, Tim Perez-Ross, Jane McNeill, Zach Hanner, Rasool J'Han, Troy Rudeseal",3.0,84,"Two million fish washed ashore. One thousand blackbirds dropped from the sky. On July 4, 2009 a deadly menace swept through the quaint seaside town of Claridge, Maryland, but the harrowing story of what happened that Independence Day has never been told—until now. The authorities believed they had buried the truth about the tragedy that claimed over 700 human lives. Now, three years later, a reporter has emerged with footage revealing the cover-up and an unimaginable killer: a mysterious parasitic outbreak. Told from the perspective of those who were there and saw what happened, The Bay unfolds over 24 hours through people’s iPhones, Androids, 911 calls, webcams, and whatever else could be used to document the nightmare in Claridge. What follows is a nerve-shredding tale of a small town plunged into absolute terror. ×",https://a.ltrbxd.com/resized/film-poster/9/6/7/6/8/96768-the-bay-0-230-0-345-crop.jpg?v=3e0e7f9ee5,https://letterboxd.com/film/the-bay/
Play Misty for Me,"Universal Pictures, Malpaso Productions",1971,"Drama, Thriller",Clint Eastwood,"Robert Daley, Bob Larson, Jennings Lang","Clint Eastwood, Jessica Walter, Donna Mills, John Larch, Jack Ging, Irene Hervey, James McEachin, Clarice Taylor, Don Siegel, Duke Everts, George Fargo, Mervin W. Frates, Tim Frawley, Otis Kadani, Brit Lind, Paul E. Lippman, Jack Kosslyn, Ginna Patterson, Malcolm Moran, Cannonball Adderley, Boyd Cabeen, Barbara Chrysler, Don Hamilton, Robert S. Holman, Johnny Otis, Walter Scott, William Tomlinson",3.4,102,"A brief fling between a male disc jockey and an obsessed female fan takes a frightening, and perhaps even deadly turn when another woman enters the picture.",https://a.ltrbxd.com/resized/film-poster/4/2/4/0/7/42407-play-misty-for-me-0-230-0-345-crop.jpg?v=9eca33deb2,https://letterboxd.com/film/play-misty-for-me/
Halloween: The Curse of Michael Myers,"Halloween VI Productions, Nightfall Productions, Trancas International Films, Dimension Films",1995,"Horror, Thriller",Joe Chappelle,"Malek Akkad, Paul Freeman","Donald Pleasence, Paul Rudd, Marianne Hagan, Mitchell Ryan, Kim Darby, Bradford English, Keith Bogart, Mariah O'Brien, Leo Geter, J.C. Brandy, Devin Gardner, Susan Swift, George P. Wilbur, Janice Knickrehm, Alan Echeverria, Hildur Ruriks, Sheri Hicks, Tom Proctor, Bryan Morris, Lee Ju Chew, Raquelle Anderson, Kristine Summers, Elyse Donalson, A. Michael Lerner, Jimmy Chunga, Brad Hardin, Fred Lerner, James Woodson, Danielle Harris",2.0,88,"Six years after being kidnapped by a cult, Jamie tries to escape the clutches of her serial killer uncle, Michael Myers.",https://a.ltrbxd.com/resized/film-poster/4/5/7/1/4/45714-halloween-the-curse-of-michael-myers-0-230-0-345-crop.jpg?v=06466c396c,https://letterboxd.com/film/halloween-the-curse-of-michael-myers/
Stroszek,"Werner Herzog Filmproduktion, ZDF",1977,Drama,Werner Herzog,"Willi Segler, Werner Herzog","Bruno S., Eva Mattes, Clemens Scheitz, Wilhelm von Homburg, Burkhard Driest, Clayton Szalpinski, Ely Rodriguez, Alfred Edel, Scott McKain, Pitt Bedewitz, Ralph Wade, Michael Gahr, Vaclav Vojta, Yüksel Topcugürler",4.1,107,"Bruno Stroszek is released from prison and warned to stop drinking. He has few skills and fewer expectations: with a glockenspiel and an accordion, he ekes out a living as a street musician. He befriends Eva, a prostitute down on her luck and they join his neighbor, Scheitz, an elderly eccentric, when he leaves Germany to live in Wisconsin.",https://a.ltrbxd.com/resized/film-poster/4/5/0/5/6/45056-stroszek-0-230-0-345-crop.jpg?v=290be3ee0e,https://letterboxd.com/film/stroszek/
Status Update,Voltage Pictures,2018,"Comedy, Fantasy, Science Fiction",Scott Speer,Adam Shankman,"Ross Lynch, Olivia Holt, Harvey Guillén, Courtney Eaton, Gregg Sulkin, Brec Bassinger, Maude Green, Markian Tarasiuk, Andrew Herr, Micah, Austin Anozie, Vivian Full, Tyronne L'Hirondelle, Alexandra Siegel, Nicholas Lea, Max Chadburn, Maria J. Cruz, Diana Bang, Gillian Barber, Glenn Beck, Lyova Beckwitt, April Cameron, Osric Chau, Griffin Correros, Martin Donovan, David Hardware, Mad Harper, John Michael Higgins, Rhianna Jagpal, Famke Janssen, Tyler Layton-Olson, Colton Mackie, Wendi McLendon-Covey, Marcia Moulton, Kane Nelson, Josh Ostrovsky, Rob Riggle, Tessa Tamura, Megan Serena Trainer, Joe Tuliao, Colleen Bradford, Liam Raymond Dib, Dean Alonzo Hoover, Derek Schnobb",2.2,106,"After being uprooted by his parents’ separation and unable to fit into his new hometown, a teenager stumbles upon a magical app that causes his social media updates to come true.",https://a.ltrbxd.com/resized/film-poster/3/5/0/3/9/5/350395-status-update-0-230-0-345-crop.jpg?v=604b9b59d7,https://letterboxd.com/film/status-update/
Cat People,"Universal Pictures, RKO Pictures LLC, Charles Fries Productions",1982,"Horror, Thriller",Paul Schrader,Charles W. Fries,"Nastassja Kinski, Malcolm McDowell, John Heard, Annette O'Toole, Ruby Dee, Ed Begley Jr., Scott Paulin, Frankie Faison, Ron Diamond, Lynn Lowry, John Larroquette, Tessa Richarde, Patricia Perkins, Berry Berenson, Fausto Barajas, John H. Fields, Emery Hollier, Stephen Marshal, Robert Pavlovich, Julie Denney, Arione De Winter, Francine Segal, Don Hood, David Showacre, Neva Gage, Marisa Folse, Danelle Hand, John C. Isbell, Roger E. Reid, Charles Joseph Konya Jr., Marco St. John, Brett Alexander, Gregory Gatto, Terc Martinez, David Ross McCarty, Harry Hauss, James Deeth, Ray Wise, Jo Ann Dearing",3.2,118,"After years of separation, Irena Gallier and her minister brother, Paul, reunite in New Orleans. When zoologists capture a wild panther, Irena is drawn to the cat – and zoo curator Oliver to her. Soon, Paul will have to reveal the family secret: that when sexually aroused, they revert into predatory jungle cats.",https://a.ltrbxd.com/resized/film-poster/4/8/3/9/0/48390-cat-people-0-230-0-345-crop.jpg?v=777508c69e,https://letterboxd.com/film/cat-people-1982/
Love Is Dead,"TF1 Droits Audiovisuels, De Films En Aiguille, SCOPE Pictures",2016,Comedy,Éric Capitaine,N/A,"Benjamin Lavernhe, Elisa Ruschke, Aïssa Maïga, Camille Chamoux, Fernand Dubois, François Bégaudeau, Berdine Nusselder, Antoine Gouy, Brigitte Roüan, Christelle Cornil, Jérôme de Falloise, Jérôme Niel, Odile Matthieu, Philippe Vieux, Renaud Rutten, Sam Karmann",3.0,95,N/A,https://a.ltrbxd.com/resized/film-poster/3/6/1/3/0/8/361308-love-is-dead-0-230-0-345-crop.jpg?v=7dada69d29,https://letterboxd.com/film/love-is-dead-2016/
A Copenhagen Love Story,Miso Film,2025,"Romance, Drama","Ditte Hansen, Louise Mieritz","Jenny Mattesen, Jonas Allen","Rosalinde Mynster, Joachim Fjelstrup, Sara Fanta Traore, Mille Lehfeldt, Magnus Haugaard, Magnus Millang, Sargun Oshana, Anne Marie Helger, Mia Lerdam, Sarah Juel Werner, Youssef Wayne Hvidtfeldt, Bahar Pars, Tue Lunding, Anders W. Berthelsen, Anna Neye, Niels Anders Thorn, Mikkel Arndt, Trine Gadeberg, Christiane Gjellerup Koch, Ane Helene Hovby, William Halken, Bjørka Fagan, Philip Kiget-Dynowski, Felix Aas Schultz, Ask Berntsen, Kasper Le Fevre, David Dam Jexen",2.9,105,"After author Mia finds love with single father Emil, their happiness is put to the test as they undergo fertility treatments to have kids of their own.",https://a.ltrbxd.com/resized/film-poster/1/3/0/6/0/5/5/1306055-a-copenhagen-love-story-0-230-0-345-crop.jpg?v=4212ca8d78,https://letterboxd.com/film/a-copenhagen-love-story/
Elizabethtown,"Paramount Pictures, Cruise/Wagner Productions, Vinyl Films, KMP Film Invest",2005,"Drama, Romance, Comedy",Cameron Crowe,"Paula Wagner, Andy Fischer, Cameron Crowe, Tom Cruise","Orlando Bloom, Kirsten Dunst, Susan Sarandon, Alec Baldwin, Bruce McGill, Judy Greer, Jessica Biel, Paul Schneider, Loudon Wainwright III, Gailard Sartain, Jed Rees, Paula Deen, Dan Biggers, Alice Marie Crowe, Tim Devitt, Ted Manson, Maxwell Moss Steen, Reid Thompson Steen, Shane Lyons, Emily Rutherfurd, Michael Naughton, Griffin Grabow, Nina Jefferies, Emily Goldwyn, Kristin Lindquist, Allison Munn, Tom Humbarger, Patty Griffin, Gregory North, Steve Seagren, Guy Stevenson, Jeffrey De Serrano, Jeanette O'Connor, Catherine McGoohan, Sean Nepita, Dena DeCola, David Brandt, Jenny Gregg Stewart, Delaney Keefe, Travis Howard, Bobby Daniels, Rod Burke, Nate Mooney, Judy Pryor Trice, Jim Fitzpatrick, Jim James, Two-Tone Tommy, Patrick Hallahan, Charlie Crowe, Carl Broemel, Scott Sener, John M. Sullivan, Sonny King, Erwin Russell Marlowe, Michael Hatch, Masam Holden, Kelly Pendygraft, Jennifer Woods, Alana Ball, Russell George, Ralph Conlee, Billy Tencza, Hailey Knight, Nicky Roos, Zane Rice, Kassie Pinegar, Daya Fernandez, Michael Jaroscak, Nigel Miguel, Samantha Ray, Nicole Spector, Leslie David Baker, John D. Crawford",3.0,123,"Drew Baylor is fired after causing his shoe company to lose hundreds of millions of dollars. To make matters worse, he’s also dumped by his girlfriend. On the verge of ending it all, Drew gets a new lease on life when he returns to his family’s small Kentucky hometown after his father dies. Along the way, he meets a flight attendant with whom he falls in love.",https://a.ltrbxd.com/resized/sm/upload/vd/4m/mx/i7/Asn50mIjDaeDKbaJkQ7lY6goV8p-0-230-0-345-crop.jpg?v=32d2ed4470,https://letterboxd.com/film/elizabethtown/
The Clown,"Mondo Cane Filmes, Bananeira Filmes, Globo Filmes",2011,"Comedy, Drama",Selton Mello,Selton Mello,"Selton Mello, Paulo José, Larissa Manoela, Danton Mello, Giselle Motta, Teuda Bara, Álamo Facó, Cadu Fávero, Erom Cordeiro, Hossen Minussi, Maira Chasseroux, Thogun Teixeira, Michelle Martins, Bruna Chiaradia, Renato Macedo, Tony Tonelada, Pritty Borges, Fabiana Karla, Jorge Loredo, Jackson Antunes, Moacyr Franco, Tonico Pereira, Ferrugem, Maria Manoella, Emílio Orciollo Netto, Martha Meola, Phil Miler, Flávio Pardal, Cico Caseira",3.7,90,"The life of the owners of Circus Esperança, Puro Sangue e Pangaré, father and son, who plays two clowns. At a certain point, Pangaré starts showing tiredness and sadness for being an unhappy clown.",https://a.ltrbxd.com/resized/film-poster/6/6/3/6/6/66366-the-clown-0-230-0-345-crop.jpg?v=717fd2eb0d,https://letterboxd.com/film/the-clown/
Querelle,"Gaumont, Planet Film",1982,"Fantasy, Drama",Rainer Werner Fassbinder,"Burkhard Driest, Dieter Schidor, Sam Waynberg","Brad Davis, Franco Nero, Jeanne Moreau, Laurent Malet, Hanno Pöschl, Günther Kaufmann, Burkhard Driest, Roger Fritz, Dieter Schidor, Natja Brunckhorst, Robert van Ackeren, Werner Asam, Isolde Barth, Axel Bauer, Neil Bell, Gilles Gavois, Wolf Gremm, Karl-Heinz von Hassel, Y Sa Lo, Michael McLernon, Frank Ripploh, Karl Scheydt, Vitus Zeplichal, Isa Jank",3.7,108,"A handsome Belgian sailor on shore leave in the port of Brest, who is also a drug-smuggler and murderer, embarks upon a voyage of highly charged and violent homosexual self-discovery that will change him forever from the man he once was.",https://a.ltrbxd.com/resized/film-poster/2/2/9/3/1/22931-querelle-0-230-0-345-crop.jpg?v=8de783442b,https://letterboxd.com/film/querelle/
An American in Paris,Metro-Goldwyn-Mayer,1951,"Comedy, Romance, Music",Vincente Minnelli,"Arthur Freed, Roger Edens","Gene Kelly, Leslie Caron, Oscar Levant, Georges Guétary, Nina Foch, Robert Ames, Joan Anderson, Larry Arnold, Martha Bamattre, Charles Bastin, Joan Bayley, Rodney Bieber, Madge Blake, Ralph Blum, Nan Boardman, Dino Bolognese, Eugene Borden, Ann Brendon, Peter Camlin, Benny Carter, Sue Casey, Monique Chantal, Andre Charisse, Bill Chatham, Jack Chefe, Dick Cherney, Ann Codee, Louise Colombet, Allan Cook, Gino Corrado, Paul Cristo, Susan Cummings, Albert D'Arno, Viola Daniels, George Davis, Paul De Corday, René de Loffre, Gloria Dea, George Dee, Jeannine Ducasse, Art Dupuis, John Eldredge, Carli Elinor, Marietta Elliott, George Ellsworth, Luigi Faccuito, Ernie Flatt, Bess Flowers, Clair Freeman, Mary Jane French, Captain Garcia, Jon Gardner, Mary Gleason, Shirley Glickman, Ricky Gonzales, Ricardo Gonzáles, Alex Goudovitch, Andre Guy, Claude Guy, Patricia Hall, Betty Hannon, Jack Harmon, Jean Harrison, Lars Hensen, Marian Horosko, Don Hulbert, Dickie Humphreys, Harvey Karels, David Kasday, Paul King, Stephen Kirchner, Isabel La Mal, Tommy Ladd, Jeanne Lafayette, Judy Landon, Richard Landry, Michele Lange, Numa Lapeyre, Louise Laureau, Louis Laurent, Janet Lavis, Meredith Leeds, Diki Lerner, Ruth Lewis, Shirley Lopez, Ralph Madlener, Bert Madrid, Dudley Field Malone, Bob Mascagno, Charles Mauu, Paul Maxey, Anthony Mazzola, Leonard A. Mazzola, Greg McClure, Svetlana McLee, Mary Menzies, Sheila Meyers, Charles Millsfield, Leo Mostovoy, Noel Neill, Anna Q. Nilsson, Allen O'Locklin, Charles Owens, Alfred Paix, Jetsy Parker, Christian Pasques, Hamil Petroff, Lucien Plauzoles, Pierre Plauzoles, Albert Pollet, Waclaw Rekwart, Ricky Ricardi, Carol Risser, Marilyn Rogers, Jean Romaine, Alex Romero, Hayden Rorke, Dennis Ross, Albert Ruiz, Marilyn Russell, Betty Scott, Linda Scott, Rudolph Silva, Pat Simms, Mabel Smaney, Melba Snowden, John Stanley, Sam Strangis, Beverly Thompson, Peter Troiekouroff, Dee Turnell, Dorothy Tuttle, Maya Van Horn, Pat Volasko, Dorothy Ward, Ray Weamer, Pamela Wells, Dick Wessel, Herbert Winters, Mary Young, Lila Zali, Marie Antoinette Andrews, Felice Basso, Janine Bergez, Florence Brundage, Monica Bucky, David Carlin, Ralph Del Campo, Marie Francoise, Madeline Gradine, Linda Heller, Madge Journeay, Eileen Locklin, Wanda Lucienne, Bonnie Menzies, Roy Ossorio, Don Quinn, Anne Belle Rasmussen, Phyllis Sutton, Yves Troendle",3.7,113,"Jerry Mulligan is an exuberant American expatriate in Paris trying to make a reputation as a painter. His friend Adam is a struggling concert pianist who’s a long time associate of a famous French singer, Henri Baurel. A lonely society woman, Milo Roberts, takes Jerry under her wing and supports him, but is interested in more than his art.",https://a.ltrbxd.com/resized/film-poster/5/0/1/0/2/50102-an-american-in-paris-0-230-0-345-crop.jpg?v=c305666703,https://letterboxd.com/film/an-american-in-paris/
Playing,"Matizar, VideoFilmes",2007,Documentary,Eduardo Coutinho,Raquel Freire Zangrandi,"Fernanda Torres, Marília Pêra, Andréa Beltrão, Aleta Gomes Vieira, Mary Sheila, Débora Almeida, Gisele Alves Moura, Jeckie Brown, Lana Guelero, Maria de Fátima Barbosa, Marina D'Elia, Sarita Houli Brumer, Claudiléa Cerqueira de Lemos",4.3,105,"Following a newspaper ad, ordinary women tell part of their life stories to director Eduardo Coutinho, which are then re-enacted by actresses, blurring the barriers between truth, fiction and interpretation.",https://a.ltrbxd.com/resized/film-poster/7/2/9/6/3/72963-playing-0-230-0-345-crop.jpg?v=8041881110,https://letterboxd.com/film/playing/
On the Basis of Sex,"Participant, Alibaba Pictures Group, Robert Cort Productions",2018,"Drama, History",Mimi Leder,"Robert W. Cort, Jonathan King, Erin F. Larsen","Felicity Jones, Armie Hammer, Justin Theroux, Sam Waterston, Kathy Bates, Cailee Spaeny, Callum Shoniker, Jack Reynor, Stephen Root, Ronald Guttman, Chris Mulkey, Gary Werntz, Francis X. McCarthy, Ben Carlson, Ruth Bader Ginsburg, Amanda MacDonald, Karl Graboshas, Angela Galuppo, Joe Cobden, Dawn Ford, Michael Dickson, Holly Gauthier-Frankel, Jeff Lillico, Arthur Holden, Gabrielle Graham, Wendy Crewson, John Ralston",3.5,120,Young lawyer Ruth Bader Ginsburg teams with her husband Marty to bring a groundbreaking case before the U.S. Court of Appeals and overturn a century of sex discrimination.,https://a.ltrbxd.com/resized/film-poster/2/6/8/9/4/0/268940-on-the-basis-of-sex-0-230-0-345-crop.jpg?v=95f4f39806,https://letterboxd.com/film/on-the-basis-of-sex/
I Lost My Body,"Studio Xilam, Auvergne-Rhône-Alpes Cinéma",2019,"Animation, Drama, Fantasy",Jérémy Clapin,Marc Du Pontavice,"Hakim Faris, Victoire du Bois, Patrick d'Assumçao, Alfonso Arfi, Hichem Mesbah, Myriam Loucif, Bellamine Abdelmalek, Maud Le Guenedal, Nicole Favart, Quentin Baillot, Céline Ronté, Deborah Grall, Pascal Rocher, Bruno Hausler, Jocelyn Veluire, Raymond Hosni, Guillaume Desmarchellier",3.8,81,"A story of Naoufel, a young man who is in love with Gabrielle. In another part of town, a severed hand escapes from a dissection lab, determined to find its body again.",https://a.ltrbxd.com/resized/film-poster/5/1/4/7/0/2/514702-i-lost-my-body-0-230-0-345-crop.jpg?v=d58f4ad597,https://letterboxd.com/film/i-lost-my-body/
