Title,Studios,Year,Genre,Director,Producers,Cast,AvgRating,Duration,Description,Poster URL,Page URL
Eternity and a Day,"Eurimages, ARTE (FR), Paradis Films, Istituto Luce Cinecittà, Greek Film Centre, La Sept Cinéma, Intermédias, Theo Angelopoulos Films, Classic Productions, Canal+, WDR, EPT",1998,Drama,Theo Angelopoulos,"Amedeo Pagani, Éric Heumann, Giorgio Silvagni, Theo Angelopoulos, Martin Wiebel","Bruno Ganz, Fabrizio Bentivoglio, Isabelle Renauld, Achileas Skevis, Alexandra Ladikou, Despina Bebedelli, Eleni Gerasimidou, Iris Chatziantoniou, Nikos Kouros, Alekos Oudinotis, Vasilis Kolovos, Mihalis Giannatos, Petros Fyssoun, Pemi Zouni, Lazaros Andreou, Leonidas Vardaros, Vassilia Kavouka, Petros Markaris, Melpo Lekatsa, Yiannis Karabinis, Maria Hatziioannidou, Yiannis Mohlas, Maria Saltiri, Makis Pappas, Tania Palaiologou, Aristotelis Aposkitis, Rony Ganniari, Panos Papageorgopoulos, Maria Koskina, Thodoros Tsalouhidis, Thodoros Teknetzidis, Hristos Sougaris, Giannis Papadopoulos, Milena Giannakidou, Argyris Kesoglou, Melpomeni Tsoulou, Yiannis Mitsou, Petros Patses, Yiorgos Popof, Dimitris Fotsinos-Safrantzas, Yiorgos Halaris, Themis Gousoulis, Asimakis Alexiou, Thodoris Papadimitriou",4.4,133,"An ailing Greek man attempts to take a young, illegal Albanian immigrant home.",https://a.ltrbxd.com/resized/sm/upload/1c/3g/el/vf/7Pa5lWKSi7ILyHl2CwcJinIEkAN-0-230-0-345-crop.jpg?v=b2f8254cac,https://letterboxd.com/film/eternity-and-a-day/
Friday the 13th Part VIII: Jason Takes Manhattan,Paramount Pictures,1989,"Horror, Thriller",Rob Hedden,"Randy Cheveldave, Barbara Sachs","Jensen Daggett, Sharlene Martin, Scott Reeves, Tiffany Paulsen, Alex Diakun, Amber Pawlick, Kane Hodder, Kelly Hu, Todd Caldecott, Peter Mark Richman, Barbara Bingham, Warren Munson, Fred Henderson, Saffron Henderson, Martin Cummins, David Longworth, Vince Cupone, Tim Mirkovich, Gordon Currie, Sam Sarkar, Roger Barnes, Michael Benyaer, Peggy Hedden, Vincent Craig Dupree, David Jacox, Jasper Cole, Ken Kirzinger",2.1,100,"Jason ships out aboard a teen-filled “love boat” bound for New York, which he soon transforms into the ultimate voyage of the damned.",https://a.ltrbxd.com/resized/film-poster/4/6/3/7/2/46372-friday-the-13th-part-viii-jason-takes-manhattan-0-230-0-345-crop.jpg?v=9ac5114625,https://letterboxd.com/film/friday-the-13th-part-viii-jason-takes-manhattan/
Touki Bouki,"Studio Kankourama, Cinegrit",1973,"Drama, Romance",Djibril Diop Mambéty,Medoune Faye,"Magaye Niang, Myriam Niang, Christoph Colomb, Mustapha Ture, Aminata Fall, Ousseynou Diop, Ndou Labia",3.8,91,"Mory, a cowherd, and Anta, a university student, try to make money in order to go to Paris and leave their boring past behind.",https://a.ltrbxd.com/resized/film-poster/6/4/2/2/0/64220-touki-bouki-0-230-0-345-crop.jpg?v=c4db93f284,https://letterboxd.com/film/touki-bouki/
Doom,"di Bonaventura Pictures, John Wells Productions, Reaper Productions, Stillking Films, Doom Productions, Distant Planet Productions, Babelsberg Film",2005,"Science Fiction, Horror, Action",Andrzej Bartkowiak,"Lorenzo di Bonaventura, John Wells, Henning Molfenter, Thierry Potok, David Minkowski, Matthew Stillman","Dwayne Johnson, Karl Urban, Rosamund Pike, Deobia Oparei, Razaaq Adoti, Al Weaver, Ben Daniels, Richard Brake, Dexter Fletcher, Doug Jones, Brian Steele, Yao Chin, Robert Russell, Daniel York, Ian Hughes, Sara Houghton, Blanka Jarošová, Vladislav Dyntera, Jaroslav Pšenička, Marek Motlíček, Petr Hnětkovský, Robert Nelson, Barbara Nedeljakova, Tanoai Reed, Rana Morrison, Robert Nelson",2.1,105,"A team of space marines known as the Rapid Response Tactical Squad, led by Sarge, is sent to a science facility on Mars after somebody reports a security breach. There, they learn that the alert came after a test subject, a mass murderer purposefully injected with alien DNA, broke free and began killing people. Dr. Grimm, who is related to team member Reaper, informs them all that the chromosome can mutate humans into monsters – and is highly infectious.",https://a.ltrbxd.com/resized/film-poster/4/7/5/9/7/47597-doom-0-230-0-345-crop.jpg?v=5078a4ce69,https://letterboxd.com/film/doom/
Adventures in Babysitting,"Silver Screen Partners III, Touchstone Pictures",1987,Comedy,Chris Columbus,"Lynda Obst, Debra Hill","Elisabeth Shue, Maia Brewton, Keith Coogan, Anthony Rapp, Calvin Levels, Vincent D'Onofrio, Penelope Ann Miller, George Newbern, John Ford Noonan, Bradley Whitford, Ron Canada, John Davis Chandler, Dan Ziskie, Allan Aarons, Marcia Bennett, Rummy Bishop, David Blacker, Lolita Davidovich, John Dee, Monica Devereux, Clarke Devereux, Richard Rebiere, Rick Goldman, Deryck Hazel, John Hemphill, Frank Hill, Philip Honey, Clark Johnson, Maryann Kelman, Kirsten Kieferle, Peter Lavender, Kevin Lund, Southside Johnny, Allan Merovitz, Sam Moses, Les Nirenberg, Juan Ramírez, Diane Robin, Sandi Ross, Charlene Shipp, Sandra Shuman, Linda Sorensen, Walter Woodson, Jaap Broeker, Billy Branch, Albert Collins, Jordan-Patrick Marcantonio, David Simkins, Andrew Shue",3.4,102,"When plans with her boyfriend fall through, high school senior Chris Parker ends up babysitting the Anderson kids, Brad and Sara. What should be a quiet night in, however, turns into a series of ridiculous exploits, starting when they leave the house to pick up Chris’ friend Brenda. Soon, Brad’s buddy Daryl is involved, and the group must contend with car thieves, blues musicians and much more.",https://a.ltrbxd.com/resized/film-poster/4/3/1/4/7/43147-adventures-in-babysitting-0-230-0-345-crop.jpg?v=460d4e7e0c,https://letterboxd.com/film/adventures-in-babysitting/
Dope,"Revolt Films, Significant Productions, IamOTHER Entertainment",2015,"Drama, Crime, Comedy",Rick Famuyiwa,"Caron Veazey, Mimi Valdés, Nina Yang Bongiovi, David Grace, Erica Brady, Forest Whitaker","Shameik Moore, Zoë Kravitz, A$AP Rocky, Kiersey Clemons, Tony Revolori, Blake Anderson, Chanel Iman, Roger Guenveur Smith, LaKeith Stanfield, Tyga, De'Aundre Bonds, Bruce Beatty, Quincy Brown, Forest Whitaker, Kimberly Elise, Rick Fox, Allen Maldonado, Vince Staples, Amin Joseph, Casey Veggies, Ashton Moio, Julian Brand, Christopher Glenn, Ricky Harris, Wyking Jones, Kap G, Josh Meyer, Mimi Michaels, Lidia Porto, Simmie Sims, Milton T.J. Taylor, Benjamin Levy Aguilar, Michael Flores, Emmanuel Manzanares, Jeremy Marinas, Nino Nava, Larnell Stovall, Ryan Stroud, Alex Urbom, Jonny Yoku",3.5,103,"Malcolm is carefully surviving life in a tough neighborhood in Los Angeles while juggling college applications, academic interviews, and the SAT. A chance invitation to an underground party leads him into an adventure that could allow him to go from being a geek, to being dope, to ultimately being himself.",https://a.ltrbxd.com/resized/film-poster/2/3/5/7/4/5/235745-dope-0-230-0-345-crop.jpg?v=0e94bea64d,https://letterboxd.com/film/dope-2015/
Scouts Guide to the Zombie Apocalypse,"Broken Road Productions, Brucks Entertainment, Oops Doughnuts Productions",2015,"Horror, Comedy",Christopher Landon,"Bryan Brucks, Betsy Sullenger, Todd Garner, Andy Fickman","Tye Sheridan, Sarah Dumont, Logan Miller, Joey Morgan, David Koechner, Hiram A. Murray, Cloris Leachman, Halston Sage, Blake Anderson, Sara Malakul Lane, Laurel Harris, Patrick Schwarzenegger, Lukas Gage, Niki Koss, Drew Droege, Elle Evans, Matthew Cardarople, Missy Martinez, John Kreng",2.9,93,"Three scouts and lifelong friends join forces with one badass cocktail waitress to become the world’s most unlikely team of heroes.  When their peaceful town is ravaged by a zombie invasion, they’ll fight for the badge of a lifetime and put their scouting skills to the test to save mankind from the undead.",https://a.ltrbxd.com/resized/film-poster/1/9/7/6/2/4/197624-scouts-guide-to-the-zombie-apocalypse-0-230-0-345-crop.jpg?v=cdd12af88b,https://letterboxd.com/film/scouts-guide-to-the-zombie-apocalypse/
Falcon Lake,"Cinéfrance Studios, OnzeCinq, Metafilms",2022,"Drama, Romance, Mystery",Charlotte Le Bon,"Julien Deris, Sylvain Corbeil, Jean-Luc Ormières, David Gauquié, Nancy Grant, Jalil Lespert","Joseph Engel, Sara Montpetit, Monia Chokri, Arthur Igual, Karine Gonthier-Hyndman, Anthony Therrien, Pierre-Luc Lafontaine, Thomas Laperriere, Lévi Doré, Jeff Roop, Jacob Whiteduck-Lavoie, Éléonore Loiselle, Samir Firouz",3.9,100,A shy teenager on a summer vacation experiences the joy and pain of young adulthood when he forges an unlikely bond with an older girl.,https://a.ltrbxd.com/resized/film-poster/8/5/0/8/0/7/850807-falcon-lake-0-230-0-345-crop.jpg?v=fd6d1ca1c1,https://letterboxd.com/film/falcon-lake/
Grind,"Pandora Cinema, 900 Films, Asphalt Productions, Gaylord Films, Gerber Pictures",2003,"Adventure, Action, Comedy",Casey La Scala,"Bill Gerber, Casey La Scala, Hunt Lowry","Mike Vogel, Vince Vieluf, Adam Brody, Joey Kern, Jennifer Morrison, Bam Margera, Jason London, Summer Altice, Erin Murphy, Baron La Scala, Stephen Root, Sasha Jenson, Brian Posehn, Christopher McDonald, Donte Calarco, Olanna Taskey, Chad Fernandez, Alfred Briere, Ehren McGhehey, Jake Muxworthy, Preston Lacy, Bucky Lasek, Tom Green, Jason 'Wee Man' Acuña, Ryan Sheckler, Christine Estabrook, Randy Quaid, Bobcat Goldthwait, David Bowe, Bob Burnquist, Rachael E. Stevens, Kane Hodder, Dave Foley, Lindsay Felton",3.0,104,"Four skaters follow their idol on his summer tour in an attempt to get noticed, get sponsored, and become stars themselves.",https://a.ltrbxd.com/resized/film-poster/3/9/1/6/4/39164-grind-0-230-0-345-crop.jpg?v=aec2326a09,https://letterboxd.com/film/grind/
Henry Danger: The Movie,"Yes, Yes Coffee., Nickelodeon Productions",2025,"Action, Comedy, Family, Science Fiction",Joe Menendez,N/A,"Jace Norman, Sean Ryan Fox, Ella Anderson, Michael D. Cohen, Frankie Grande, Glee Dango, Andre Tricoteux, Cooper Barnes, Eric Mazimpaka, Rachel Drance, Michael Briganti, Peter Chao, David Kaye, Rawleigh Clements-Willis, Jason William Day, Will Erichson, Lisa Chandler, Dominique Mailloux, Zavien Garrett, Breeze Dango, Ajay Musodi, Liam Ma, Ben Comin, Ryan McEwen, Angelique Maingot, Kelsey Andries, Jaeson Lee, Nathaniel Shuker, Sam Smith, Darryl Quon, Dimitry Tsoy, Matt Kennedy, Shawn C. Orr, Bruce Crawford, Trevor Devall, Daran Norris",2.7,86,"Henry Hart meets a superfan—eager to fight crime with Kid Danger—who comes into possession of a device that can open up alternate realities. Facing a wild ride, Henry will need his best friend Jasper and his new superfan sidekick to find his way out or be stuck in another dimension forever.",https://a.ltrbxd.com/resized/film-poster/8/3/2/2/1/3/832213-henry-danger-the-movie-0-230-0-345-crop.jpg?v=4f1df16da9,https://letterboxd.com/film/henry-danger-the-movie/
Greedy People,"Hideout Pictures, Boies Schiller Entertainment, Limelight",2024,"Comedy, Crime, Mystery",Potsy Ponciroli,"Zack Schiller, Dylan Sellers, Potsy Ponciroli, Shannon Houchins, David Boies III, Chris Parker, C.J. Barbato","Himesh Patel, Joseph Gordon-Levitt, Lily James, Uzo Aduba, Tim Blake Nelson, Simon Rex, Nina Arianda, Jim Gaffigan, José María Yázpik, Joey Lauren Adams, Neva Howell, Thunderbird Dinwiddie, Yingling Zhu, Traci Lords, Michael Harding, Khetphet Phagnasay, Fracaswell Hyman, Kevin M. Brennan, Tamara Hopkins, Travis Przybylski, Kermit Rolison, Beth Corvino",3.1,113,"The eclectic residents of a small, picturesque island town must navigate a sensational murder and the discovery of a million dollars, leading to a series of increasingly bad decisions which upend the once-peaceful community.",https://a.ltrbxd.com/resized/film-poster/8/7/6/9/3/1/876931-greedy-people-0-230-0-345-crop.jpg?v=d4b0cbb3b5,https://letterboxd.com/film/greedy-people/
The Good Teacher,"Kazak Productions, Frakas Productions, France 3 Cinéma",2024,"Drama, Thriller",Teddy Lussi-Modeste,"Cassandre Warnauts, Jean-Yves Roubin, Jean-Christophe Reymond, Amaury Ovise","François Civil, Shaïn Boumedine, Toscane Duquesne, Mallory Wanecque, Bakary Kebe, Emma Boumali, Marianne Ehouman, Luna Ho Poumey, Mohamed Fadiga, Atik Jawed, Estevan Marchenoir, Agnès Hurstel, Myriam Djeljeli, Emilie Incerti-Formentini, Mustapha Abourachid, Armindo Alves de Sa, Francis Leplay, Fadily Camara, Walid Afkir, Djilali Redjal, Malo Chanson-Demange, Aaron Yapo, Mia Yapo, Gigi Ledron, Lucie Desclozeaux, Douglas Grauwels, Laurent Lévy, Dounia Sichov, Mahdi Gely, Remi Plot, Eva Huault, Mpaly Traoré, Frédéric Wang, Samir Hamiche, Diaba Kanouté, Marie Ayissi, Shahinez Maucolin, Rita Bayad, Abdelkader Allik, Cheikh Oumar Sow, Adam Dakhlaoui, Areski Allache, Margaux Billard",2.9,92,"Julien, a young teacher, is wrongfully accused of sexual misconduct by a teenage girl from his class. As he faces mounting pressures from the girl’s older brother and her classmates, the situation spirals out of control. Allegations spread, the entire school is thrown into turmoil, and the teacher has to fight to clear his name.",https://a.ltrbxd.com/resized/film-poster/9/0/1/6/7/7/901677-the-good-teacher-0-230-0-345-crop.jpg?v=e133263868,https://letterboxd.com/film/the-good-teacher-2024/
A Good Person,"Killer Films, Elevation Pictures, RocketScience, Metro-Goldwyn-Mayer",2023,"Drama, Comedy",Zach Braff,"Peter Dubois, Pamela Koffler, Ben Kuller, Christina Piovesan, Jimmy Price, Noah Segal, Christine Vachon, Zach Braff, Florence Pugh","Florence Pugh, Morgan Freeman, Molly Shannon, Celeste O'Connor, Zoe Lister-Jones, Chinaza Uche, Toby Onwumere, Nichelle Hines, Ignacio Diaz-Silverio, Alex Wolff, Brian Rojas, Oli Green, Ryann Redmond, Sydney Morton, Jackie Hoffman, Victor Cruz, Izzy Raye, Anthony Cedeño, Alexander Nicastro, Emilia Suárez, Lauren Yaffe, Jessie Mueller, Drew Gehling",3.4,128,Allison’s life falls apart following her involvement in a fatal accident. The unlikely relationship she forms with her would-be father-in-law helps her live a life worth living.,https://a.ltrbxd.com/resized/film-poster/7/1/8/2/3/6/718236-a-good-person-0-230-0-345-crop.jpg?v=83b65a1078,https://letterboxd.com/film/a-good-person-2023/
6 Underground,"Skydance Media, Bay Films",2019,"Action, Thriller, Comedy",Michael Bay,"David Ellison, Dana Goldberg, Michael Bay, Don Granger, Marco Valerio Pugini, Ildikó Kemény, Ian Bryce, David Minkowski, Jonathan Hook, Michael Kase, Katie Malott","Ryan Reynolds, Mélanie Laurent, Manuel Garcia-Rulfo, Ben Hardy, Adria Arjona, Dave Franco, Corey Hawkins, Lior Raz, Payman Maadi, Yuri Kolokolnikov, Kim Kold, Lídia Franco, James Murray, Lukhanyo Bele, George Kareman, James Carroll Jordan, Ron Funches, Daniel Adegboyega, Constantine Gregory, Roger Nevares, Tauras Cizas, Pavel Krátký, Algirdas Dainavičius, Faruk Pruti, Tamás Hagyó, Jason Oettle, James Bomalick, Shubham Saraf, Elena Rusconi, Kate Maravan, Adriano Caruso, Michael Lee, Claudio Pinto, Avery LaRae Lopez, Hazal Nehir, Jack V. Heath, Spencer John Pauley, Dharma Brown, Sebastian Roché, John Albasiny, József Tálos, Nick Von Schlippe, Remi Adeleke, Russell Wilcox, Kate Beecroft, Ali Khan, Nitro Zeus, Sonny Louis, Tom Wells, Michael Bay, Keith Dallison, Jesse Gabbard, Ikumi Yoshimatsu, Andy Cheng, Ryan Baumann, McKenzie Franklin",2.5,128,"After faking his death, a tech billionaire recruits a team of international operatives for a bold and bloody mission to take down a brutal dictator.",https://a.ltrbxd.com/resized/film-poster/4/3/9/7/1/7/439717-6-underground-0-230-0-345-crop.jpg?v=37580d3386,https://letterboxd.com/film/6-underground/
Monster High: 13 Wishes,"Nerd Corps Entertainment, Mattel",2013,"Fantasy, Family, Animation",Steve Sacks,"Ira Singerman, Tina Chow, Marge Dean, Lauren Rose","America Young, Jonquil Goode, Salli Saffioti, Kate Higgins, Debi Derryberry, Erin Fitzgerald, Audu Paden, Evan Smith, Marcus Griffin, Cam Clarke, Laura Bailey, Cindy Robinson, Julie Maddalena, Missi Hale, Jonathan Lipow",3.9,73,"It’s a new school year at Monster High™, and the little sister of Clawdeen Wolf™, Howleen, is determined to be more fangtastic than ever.  Her dream of popularity turns out to be easier than anyone imagined when she stumbles upon a genie named Gigi Grant™ who grants her not 3, but 13 Wishes!  But the ghouls quickly learn to be s-careful what you wish for because each wish comes with a dark side, and soon the student disem-body of Monster High™ is turned upside-down!  Join Frankie Stein™, Clawdeen Wolf™, Draculaura™ and the rest of their creeperiffic ghoulfriends as they journey deep inside the magic lantern to save the very soul of Monster High™… while flashing their killer style every step of the way! ×",https://a.ltrbxd.com/resized/film-poster/1/5/1/0/5/1/151051-monster-high-13-wishes-0-230-0-345-crop.jpg?v=e0536dedb6,https://letterboxd.com/film/monster-high-13-wishes/
The Guest,"HanWay Films, Snoot Entertainment",2014,"Mystery, Thriller, Action",Adam Wingard,"Keith Calder, Jessica Wu, Chris Harding","Dan Stevens, Maika Monroe, Brendan Meyer, Sheila Kelley, Leland Orser, Lance Reddick, Joel David Moore, Ethan Embry, Tabatha Shaun, AJ Bowen, Candice Patton, Chris Ellis, Chase Williamson, Steven John Brown, Brenden Wedner, Alex Knight, Nancy Jeris, Matthew Page, Katie Anne Mitchell, Frank Bond, Mike Miller, Jesse Luken, Kelsey Leos Montoya, Justin Ramsey, Tyler Riegleman, Justin Yu, Lonnie Lane, Tina Borek, Darlene Kellum, J. Nathan Simmons, Vanessa Torres",3.4,101,"A soldier introduces himself to the Peterson family, claiming to be a friend of their son who died in action. After the young man is welcomed into their home, a series of accidental deaths seem to be connected to his presence.",https://a.ltrbxd.com/resized/sm/upload/is/9i/99/04/xxSuU7Q9ZmPjw9TNQ1WzmHVAxBI-0-230-0-345-crop.jpg?v=2e435bf9c5,https://letterboxd.com/film/the-guest-2014/
Through the Olive Trees,"CiBy 2000, Abbas Kiarostami Productions, Farabi Cinema",1994,Drama,Abbas Kiarostami,"Alain Depardieu, Abbas Kiarostami","Mohammadali Keshavarz, Farhad Kheradmand, Zarifeh Shiva, Hossein Rezai, Tahereh Ladanian, Hocine Redai, Zahra Nourou, Nasret Betri, Azim Aziz Nia, Astadouli Babani, N. Boursadiki, Kheda Barech Defai, Ahmed Ahmed Poor, Babek Ahmed Poor, Mahbanou Darabi, Kardouni Nouri, Hossein Jafarian, Jafar Panahi, Abbas Kiarostami",4.2,103,"Complications arise in a director’s attempt to film a scene in Life, and Nothing More… (1992).",https://a.ltrbxd.com/resized/film-poster/1/8/2/7/2/18272-through-the-olive-trees-0-230-0-345-crop.jpg?v=ce04292aa8,https://letterboxd.com/film/through-the-olive-trees/
Scenes from a Marriage,Cinematograph AB,1974,"Romance, Drama",Ingmar Bergman,Lars-Owe Carlberg,"Liv Ullmann, Erland Josephson, Bibi Andersson, Jan Malmsjö, Gunnel Lindblom, Wenche Foss, Bertil Norström, Anita Wall, Rossana Mariano, Lena Bergman, Ingmar Bergman, Barbro Hiort af Ornäs",4.4,169,"Johan and Marianne are married and seem to have it all. Their happiness, however, is a façade for a troubled relationship, which becomes even rockier when Johan admits that he’s having an affair. Before long, the spouses separate and move towards finalizing their divorce, but they make attempts at reconciling. Even as they pursue other relationships, Johan and Marianne realize that they have a significant bond, but also many issues that hinder that connection.",https://a.ltrbxd.com/resized/film-poster/1/0/3/3/0/2/103302-scenes-from-a-marriage-0-230-0-345-crop.jpg?v=896f33ee8b,https://letterboxd.com/film/scenes-from-a-marriage/
Hardcore,"A-Team, Columbia Pictures",1979,"Drama, Mystery, Crime",Paul Schrader,Buzz Feitshans,"George C. Scott, Peter Boyle, Season Hubley, Dick Sargent, Leonard Gaines, Dave Nichols, Gary Graham, Larry Block, Marc Alaimo, Leslie Ackerman, Charlotte McGinnis, Ilah Davis, Paul Marin, Will Walker, Hal Williams, Bob Bishop, Tim Dial, Roy London, Bibi Besch, Tracey Walter, Bobby Kosser, Stephen P. Dunn, Jean Allison, Reb Brown, James Helder, Dave Thompson, John Otte, Janet Simpson, Karen Kruer, Henry Vandenbroek, Linda Smith, Mary McFerren, Judith Ransdell, Linda Morell, Gigi Vorgan, Michael Hatch, David Hockenberry, Joseph Prus, Jean Reed Bahle, Reinder Vantil, Dee Ann Johnston, Janice Carroll, Mark Natuzzi, Al Cingolani, Cherilyn Parsons, Tracey Ratley, Antonio Esparza, Linda Cremeans, Ed Begley Jr., Stewart Steinberg, Serena",3.8,108,A conservative Midwest businessman ventures into the sordid underworld of pornography in search of his runaway teenage daughter who’s making hardcore films in the pits of Los Angeles.,https://a.ltrbxd.com/resized/film-poster/2/2/8/9/4/22894-hardcore-0-230-0-345-crop.jpg?v=6f1d82a04b,https://letterboxd.com/film/hardcore/
Night Call,"Daylight Films, Formosa Productions, A Private View, Gaumont, France 3 Cinéma, VOO, BeTV, Proximus, RTL Belgium",2024,"Thriller, Action",Michiel Blanchart,"Nicolas Duval Adassovsky, Margaux Dourdin Marciano, Michaël Goldberg, Dries Phlypo, Boris Van Gils","Jonathan Feltre, Natacha Krief, Jonas Bloquet, Romain Duris, Thomas Mustin, Sam Louwyck, Laura Masci, Claire Bodson, Graham Guit, Marco Maas, Guillaume Kerbusch, Carole Trevoux, Toni d'Antonio, Valentin Wilbaux",3.6,97,"Mady, a student, works as a locksmith by night. He helps Claire get into her apartment and soon realizes that she lied to him about her identity and robbed something that belonged to a dangerous man, Yannick. Mady gets embroiled in a manhunt and will have one night to prove his innocence.",https://a.ltrbxd.com/resized/film-poster/9/0/2/0/3/5/902035-night-call-2024-0-230-0-345-crop.jpg?v=a68e3b93fc,https://letterboxd.com/film/night-call-2024/
Happy-Go-Lucky,"Film4 Productions, Thin Man Films, Ingenious Film Partners",2008,"Comedy, Drama",Mike Leigh,"Simon Channing Williams, Georgina Lowe","Sally Hawkins, Eddie Marsan, Alexis Zegerman, Sylvestra Le Touzel, Stanley Townsend, Kate O'Flynn, Caroline Martin, Oliver Maltman, Sarah Niles, Samuel Roukin, Karina Fernandez, Nonso Anozie, Sinead Matthews, Andrea Riseborough, Elliot Cowan, Joseph Kloska, Anna Reynolds, Trevor Cooper, Philip Arditti, Viss Elliot Safavi, Rebekah Staton, Jack MacGeachin, Charlie Duffield, Ayotunde Williams",3.8,118,"A look at a few chapters in the life of Poppy, a cheery, colorful, North London schoolteacher whose optimism tends to exasperate those around her.",https://a.ltrbxd.com/resized/film-poster/4/6/1/6/6/46166-happy-go-lucky-0-230-0-345-crop.jpg?v=1ed5878cce,https://letterboxd.com/film/happy-go-lucky/
"I'm a Cyborg, But That's OK","Moho Film, CJ Entertainment",2006,"Romance, Drama, Comedy",Park Chan-wook,"Chun-yeong Lee, Park Chan-wook, June Lee","Lim Soo-jung, Rain, Oh Dal-su, Lee Yeong-mi, Kim Chun-gi, Park Jun-myun, Cheon Seong-hoon, Choi Hee-jin, Lee Yong-nyeo, Son Young-soon, Park Byung-eun, Kim Byeong-ok, Lee Ji-hyeon, joo hae-eun, Jung-yong Lee, Joo Yoo-Rang",3.7,105,"Young-goon, mentally deranged and frequently electro-charging herself with a transistor radio, has been admitted into a mental institution. Firmly believing herself to be a cyborg, she refuses to consume like a human being. Il-soon is another patient, who catches the eye of Young-goon and soon becomes a close friend. Il-soon is now confronted with the biggest task: to cure Young-goon’s mental problem and have her eat real food.",https://a.ltrbxd.com/resized/film-poster/4/8/8/3/2/48832-i-m-a-cyborg-but-that-s-ok-0-230-0-345-crop.jpg?v=45608aa1b0,https://letterboxd.com/film/im-a-cyborg-but-thats-ok/
Ad Vitam,Les Films du Cap,2025,"Action, Drama, Thriller, Crime",Rodolphe Lauga,"Guillaume Canet, Jean Cottin","Guillaume Canet, Alexis Manenti, Stéphane Caillard, Nassim Lyes, Zita Hanrot, Johan Heldenbergh, Etienne Guillou-Kervern, Jamel Blissat, Maurice Chan, Laurent Merillon",2.5,97,"When he and his pregnant wife are attacked in their home, a former elite agent becomes trapped in a deadly manhunt tied to his own painful past.",https://a.ltrbxd.com/resized/film-poster/1/1/4/5/8/8/7/1145887-ad-vitam-2025-0-230-0-345-crop.jpg?v=e884141127,https://letterboxd.com/film/ad-vitam-2025/
The Beatles: Get Back,"WingNut Films, Apple Corps",2021,"Documentary, Music",Peter Jackson,"Jonathan Clyde, Clare Olssen, Paul McCartney, Ringo Starr, Yoko Ono, Olivia Harrison, Peter Jackson","John Lennon, Paul McCartney, George Harrison, Ringo Starr",4.5,468,"The three-part documentary series, compiled from over 60 hours of unseen footage, captures the warmth, camaraderie, and creative genius that defined the legacy of music’s most iconic foursome. The series also includes – for the first time in its entirety – The Beatles’ final performance at London’s Savile Row.",https://a.ltrbxd.com/resized/film-poster/7/9/5/7/5/5/795755-the-beatles-get-back-0-230-0-345-crop.jpg?v=954baf1fed,https://letterboxd.com/film/the-beatles-get-back/
Blue,"Omega Micott Inc., Hiromi, Eisei Gekijo",2002,"Romance, Drama",Hiroshi Ando,Dai Miyazaki,"Mikako Ichikawa, Manami Konishi, Asami Imajuku, Sousuke Takaoka, Ayano Nakamura, Yoko Hirayama, Ayaka Ota, Jun Murakami, Yoshida Asahi, Kenzō Kawarasaki, Rin Onomichi",3.8,116,An introverted schoolgirl falls in love and starts a relationship with one of her classmates. Set in a small seaside town in Japan.,https://a.ltrbxd.com/resized/film-poster/8/1/5/0/1/81501-blue-0-230-0-345-crop.jpg?v=2e71844f4d,https://letterboxd.com/film/blue-2002/
