Title,Studios,Year,Genre,Director,Producers,Cast,AvgRating,Duration,Description,Poster URL,Page URL
Jawbreaker,"Crossroads Films, TriStar Pictures, Kramer-Tornell Productions, Film Kitchen",1999,"Comedy, Horror, Crime",Darren Stein,"Lisa Tornell, Stacy Kramer, Adam Silverman, Thom Colwell","Rose McGowan, Rebecca Gayheart, Julie Benz, Judy Greer, Pam Grier, Carol Kane, Chad Christ, Ethan Erickson, Tatyana Ali, Charlotte Ayanna, Jeff Conaway, William Katt, P. J. Soles, Marilyn Manson, Vylette Fagerholm, The Donnas, Alexandra Adi, Claudine Claudio, Brian Gattas, Lisa Robin Kelly, Sandy Martin, Michael McLafferty, Donna Pieroni, Ann Russo, Rebecca Street, Rachel Winfree",3.4,87,"When an exclusive clique of teenage socialites accidentally murder their best friend on the morning of her birthday, the three girls responsible conspire to hide the truth.",https://a.ltrbxd.com/resized/film-poster/4/0/0/2/2/40022-jawbreaker-0-230-0-345-crop.jpg?v=dd62c118d5,https://letterboxd.com/film/jawbreaker/
Escape Room,"Columbia Pictures, Original Film",2019,"Mystery, Thriller, Horror",Adam Robitel,"Neal H. Moritz, Ori Marmur, Karina Rahardja","Taylor Russell, Logan Miller, Jay Ellis, Deborah Ann Woll, Nik Dodani, Tyler Labine, Yorick van Wageningen, Cornelius Geaney Jr., Russell Crous, Bart Fouche, Jessica Sutton, Paul Hampshire, Vere Tindale, Kenneth Fok, Caely-Jo Levy, Jamie-Lee Money, Jeremy Jess Boado, Inge Beckmann, Carl Coetzee, Katheryn Griffiths, Gary Green, Raven Swart, Dan Gruenberg, Gino Lee, Álex Martínez, Rebecca Riedy, Adam Robitel, Pete Sepenuk, Mario Tardón, Alfredo Tavares",2.9,100,"Six strangers find themselves in circumstances beyond their control, and must use their wits to survive.",https://a.ltrbxd.com/resized/film-poster/4/5/2/1/9/0/452190-escape-room-0-230-0-345-crop.jpg?v=4043f3fb65,https://letterboxd.com/film/escape-room-2019/
The Six Triple Eight,"Tyler Perry Studios, Mandalay Pictures, Her Excellency Productions, Intuition Productions",2024,"History, Drama, War",Tyler Perry,"Angi Bones, Keri Selig, Tony Strickland, Tyler Perry, Nicole Avant, Carlota Espinosa, Carole Wurst","Kerry Washington, Sam Waterston, Susan Sarandon, Oprah Winfrey, Ebony Obsidian, Shanice Williams, Kylie Jefferson, Sarah Jeffery, Pepi Sonuga, Milauna Jackson, Jay Reeves, Jeanté Godlock, Moriah Brown, Baadja-Lyne Odums, Gregg Sulkin, Dean Norris, Austin Nichols, Ben VanderMey, Nick Harris, Scott Johnson, Jeffery Thomas Johnson, Brian Kurlander, James E Hammond, Bill Barrett, Bern Cohen, Jon Wennington",3.2,130,"During World War II, the US Army’s only all-Black, all-women battalion takes on an impossible mission: sorting through a three-year backlog of 17 million pieces of mail that hadn’t been delivered to American soldiers and finish within six months.",https://a.ltrbxd.com/resized/film-poster/9/5/7/3/2/4/957324-the-six-triple-eight-2024-0-230-0-345-crop.jpg?v=6ea2359b8f,https://letterboxd.com/film/the-six-triple-eight-2024/
Mary and Max,"Melodrama Pictures, Icon Productions",2009,"Animation, Comedy, Drama",Adam Elliot,"Melanie Coombs, Pauline Piechota, Joni Rubin, Leanne Smith","Toni Collette, Philip Seymour Hoffman, Barry Humphries, Eric Bana, Bethany Whitmore, Renée Geyer, Ian 'Molly' Meldrum, John Flaus, Julie Forsyth, Christopher Massey, Oliver Marks, Daisy Kocher, Daniel Marks, Hamish Hughes, Dan Doherty, Mandy Mao, Patrick McCabe, Adam Elliot, Michael J. Allen, Bill Murphy, Shaun Patten, Bernie Clifford, Henry Karjalainen, Chris Wallace, Marlee Bevan, Melanie Coombs, Carolyn Shakespeare-Allen, Alf Klimek, Antoinette Halloran, Leanne Smith, Stephen Carroll, Athanasios Kourtidis, Yorgos Kourtidis",4.3,92,"A tale of friendship between two unlikely pen pals: Mary, a lonely, eight-year-old girl living in the suburbs of Melbourne, and Max, a forty-four-year old, severely obese man living in New York.",https://a.ltrbxd.com/resized/sm/upload/h5/ak/cq/1k/k0lQISUC4NuvKYasJn59JHc2rla-0-230-0-345-crop.jpg?v=c98c9106e5,https://letterboxd.com/film/mary-and-max/
Forgotten,"BA Entertainment, Michigan Venture Capital, Plus M Entertainment, Kiwi Media Group, Baram Pictures, Union Investment Partners, M-Line Distribution",2017,"Thriller, Crime, Mystery",Jang Hang-jun,Park Jun-sik,"Kang Ha-neul, Kim Moo-yul, Moon Sung-keun, Na Young-hee, Nam Myung-ryeol, Lee Na-ra, Bae Seong-il, Lee Soon-won, Byeon Dong-joon, Jung Chan-bi, Choi Go, Kang Sin-goo, Park Jae-yeong, Jeong Taek-hyeon, Park Chae-ik, Kwon Jae-hwan, Moon Seong-pil, Eom In-woo, Oh Hyeon-soo, Park Kyung-chan, Lee Dong-geun, Han Tae-eun, Ahn Yoo-jin, Han Da-eun, Lee Seong-woo, Lee Dong-jin, Yeon Je-hyung, Kim Hyeon-mok, Yoo In-soo, Kim Hyeon-chang, Kang Hak-soo, Jo Hong-woo, Im Jeong-min, Lee Seung-yong, An Min-young, Cho Han-na, Moon Jae-in, Donald Trump, Melania Trump, Kim Young-sam",3.7,108,"Seoul, South Korea, 1997. When the young but extremely anxious student Jin-seok, his parents and his successful older brother Yoo-seok move to a new home, mysterious and frightening events begin to happen around them, unexplained events that threaten to ruin their seemingly happy lives. Unable to understand what is happening, Jin-seok wonders if he is losing his mind.",https://a.ltrbxd.com/resized/film-poster/4/1/9/2/7/9/419279-forgotten-0-230-0-345-crop.jpg?v=edb998d4b0,https://letterboxd.com/film/forgotten-2017/
Apocalypto,"Icon Entertainment International, Icon Productions, Touchstone Pictures",2006,"Drama, Action, History",Mel Gibson,"Mel Gibson, Bruce Davey, Farhad Safinia, Sergio Miranda","Rudy Youngblood, Raoul Max Trujillo, Gerardo Taracena, Iazua Larios, Antonio Monroy, María Isabel Díaz Lago, Dalia Hernández, Jonathan Brewer, Morris Birdyellowhead, Carlos Emilio Báez, Amilcar Ramírez, Israel Contreras, Israel Ríos, Espiridion Acosta Cache, Mayra Sérbulo, Rodolfo Palacios, Lorena Heranandez, Itandehui Gutierrez, Sayuri Gutierrez, Hiram Soto, José Suárez, Ariel Galván, Bernardo Ruiz, Ricardo Diaz Mendoza, Richard Can, Carlos Ramos, Ammel Rodrigo Mendoza, Marco Antonio Argueta, Javier Escobar, Fernando Hernández, Maria Isidra Hoil, Aquetzali García, Abel Woolrich, Nicolás Jasso, Ronaldo Eknal, Miriam Tun, Rafael Velez, Diana Botello, Joaquin Rendon",3.8,139,"Set in the Mayan civilization, when a man’s idyllic presence is brutally disrupted by a violent invading force, he is taken on a perilous journey to a world ruled by fear and oppression where a harrowing end awaits him. Through a twist of fate and spurred by the power of his love for his woman and his family he will make a desperate break to return home and to ultimately save his way of life.",https://a.ltrbxd.com/resized/film-poster/5/0/9/5/5/50955-apocalypto-0-230-0-345-crop.jpg?v=a8148e5e1d,https://letterboxd.com/film/apocalypto/
Black Box Diaries,"STAR SANDS, Hanashi Films, Cineric Creative, Spark Features",2024,Documentary,Shiori Ito,"Eric Nyari, Hanna Aqvilin, Shiori Ito, Takashi Shinomiya, Ryo Yukizane, Ema Ryan Yamazaki, Yuta Okamura","Shiori Ito, Noriyuki Yamaguchi, Shinzo Abe",4.0,103,"Journalist Shiori Ito embarks on a courageous investigation of her own sexual assault in an improbable attempt to prosecute her high-profile offender. Her quest becomes a landmark case in Japan, exposing the country’s outdated judicial and societal systems.",https://a.ltrbxd.com/resized/film-poster/1/0/9/8/3/1/7/1098317-black-box-diaries-0-230-0-345-crop.jpg?v=e1b258a7c0,https://letterboxd.com/film/black-box-diaries/
Wallace & Gromit: The Curse of the Were-Rabbit,"Aardman, DreamWorks Animation",2005,"Adventure, Family, Comedy, Animation","Steve Box, Nick Park","Claire Jennings, Peter Lord, Nick Park, Carla Shelley, David Sproxton","Peter Sallis, Ralph Fiennes, Helena Bonham Carter, Peter Kay, Nicholas Smith, Liz Smith, John Thomson, Mark Gatiss, Vincent Ebrahim, Geraldine McEwan, Edward Kelsey, Dicken Ashworth, Robert Horvath, Pete Atkin, Noni Lewis, Ben Whitehead, Christopher Fairbank, James Mather, William Vanderpuye, Nigel Pilkington",3.9,85,"Cheese-loving eccentric Wallace and his cunning canine pal, Gromit, investigate a mystery in Nick Park’s animated adventure, in which the lovable inventor and his intrepid pup run a business ridding the town of garden pests. Using only humane methods that turn their home into a halfway house for evicted vermin, the pair stumble upon a mystery involving a voracious vegetarian monster that threatens to ruin the annual veggie-growing contest.",https://a.ltrbxd.com/resized/film-poster/5/1/5/8/4/51584-wallace-gromit-the-curse-of-the-were-rabbit-0-230-0-345-crop.jpg?v=6ac9f0b386,https://letterboxd.com/film/wallace-gromit-the-curse-of-the-were-rabbit/
Three Colours: Red,"MK2 Films, France 3 Cinéma, CAB Productions, Studio Filmowe Tor, TSR",1994,"Mystery, Drama, Romance",Krzysztof Kieślowski,Marin Karmitz,"Irène Jacob, Jean-Louis Trintignant, Frédérique Feder, Jean-Pierre Lorit, Samuel Le Bihan, Marion Stalens, Teco Celio, Bernard Escalon, Jean Schlegel, Elżbieta Jasińska, Paul Vermeulen, Jean-Marie Daunas, Roland Carey, Brigitte Raul, Leo Ramseyer, Nader Farman, Cécile Tanner, Anne Theurillat, Neige Dolsky, Jessica Korinek, Marc Autheman, Juliette Binoche, Julie Delpy, Benoît Régent, Zbigniew Zamachowski",4.3,100,"Part-time model Valentine unexpectedly befriends a retired judge after she runs over his dog. At first, the grumpy man shows no concern about the dog, and Valentine decides to keep it. But the two form a bond when she returns to his house and catches him listening to his neighbors’ phone calls.",https://a.ltrbxd.com/resized/film-poster/5/1/9/4/0/51940-three-colors-red-0-230-0-345-crop.jpg?v=6347a21b2c,https://letterboxd.com/film/three-colours-red/
Transformers: Dark of the Moon,"Paramount Pictures, di Bonaventura Pictures, DeSanto/Murphy Productions, Ian Bryce Productions",2011,"Action, Science Fiction, Adventure",Michael Bay,"Kenny Bates, Ian Bryce, Tom DeSanto, Lorenzo di Bonaventura, Don Murphy, Allegra Clegg, Matthew Cohan, Michael Kase","Shia LaBeouf, Rosie Huntington-Whiteley, Peter Cullen, Leonard Nimoy, John Turturro, Frances McDormand, Josh Duhamel, Tyrese Gibson, Patrick Dempsey, Hugo Weaving, John Malkovich, Kevin Dunn, Julie White, Alan Tudyk, Ken Jeong, Glenn Morshower, Lester Speight, Buzz Aldrin, Bill O'Reilly, Ravil Isyanov, Dustin Dennard, Markiss McFadden, Nick Bickle, Ajay James, Brett Lynch, Chris A. Robinson, Scott C. Roe, James D. Weston II, Brian Call, Aaron Garrido, Mikal Vega, Kenny Sheard, Josh Kelly, Keiko Agena, LaMonica Garrett, Yasen Peyankov, Brett Stimely, John H. Tobin, Drew Pillsbury, Patrick Pankhurst, Larry Clarke, Tom Virtue, Thomas Crawford, Kevin Sizemore, Alan Pietruszewski, Michael Daniel Cassady, Peter Murnik, Don Jeanes, Cory Tucker, Lindsey Ginter, David St. James, Mitch Bromwell, Elya Baskin, Eugene Alper, Inna Korobkina, Zoran Radanovich, Kathleen Gati, Annie O'Donnell, Chris Sheffield, Ken Takemoto, Michael Loeffelholz, Mindy Sterling, Stephen Monroe Taylor, Andy Daly, Derek Miller, Leidy Mazo, Scott Krinsky, Katherine Sigismund, Maile Flanagan, Darren O'Hare, Jack Axelrod, Rich Hutchman, Meredith Monroe, Charlotte Labadie, Christian Baha, Jennifer Williams, Danielle Fornarelli, Danny McCarthy, John Turk, Peter A Kelly, Mark Golden, Sean Murphy, Scott Paulson, Luis Echagarruga, Iqbal Theba, Anthony Azizi, Sammy Sheik, Mark Ryan, John S. McAfee, Jay Gates, Rebecca Cooper, Jess Harnell, Charlie Adler, Robert Foxworth, James Remar, Francesco Quinn, George Coe, Tom Kenny, Reno Wilson, Frank Welker, Ron Bottitta, John DiMaggio, Keith Szarabajka, Greg Berg, Alen Toric",2.7,154,"The Autobots continue to work for NEST, now no longer in secret. But after discovering a strange artifact during a mission in Chernobyl, it becomes apparent to Optimus Prime that the United States government has been less than forthright with them.",https://a.ltrbxd.com/resized/sm/upload/5b/qz/q0/l6/p2CcXx2AUllgwGis5jsffYQGE3F-0-230-0-345-crop.jpg?v=887640d802,https://letterboxd.com/film/transformers-dark-of-the-moon/
Con Air,"Touchstone Pictures, Jerry Bruckheimer Films",1997,"Action, Crime, Thriller",Simon West,"Jerry Bruckheimer, Kenny Bates","Nicolas Cage, John Cusack, John Malkovich, Ving Rhames, Mykelti Williamson, Dave Chappelle, Colm Meaney, Monica Potter, Landry Allbright, Rachel Ticotin, Steve Buscemi, Nick Chinlund, M.C. Gainey, Danny Trejo, Renoly Santiago, Steve Eastin, Brendan Kelly, Jesse Borrego, Carl Ciarfalio, Mongo Brownlee, José Zúñiga, Ned Bellamy, John Marshall Jones, John Roselius, Fredric Lehne, Martin McSorley, Dylan Haggerty, Dan Bell, Bob Stephenson, Scott Ditty, Tommy Bush, Lauren Pratt, Steve Hulin, Don C. McGovern, Angela Featherstone, Doug Hutchison, Jeris Poindexter, David Ramsey, Conrad Goode, Emilio Rivera, Mario Roberts, Ty Granderson Jones, Earl Billings, Greg Collins, Billy Devlin, Mark Ginther, Joseph Patrick Kelly, Jeff Olson, Dawn Bluford, Charlie Paddock, Randee Barnes, Don S. Davis, Barbara Sharma, Thomas Rosales Jr., Eddie Perez, Scott McCoy, Brian Hayes Currie, Ashley Smock, Charles Lynn Frost, Joey Miyashima, Scott Burkholder, Kevin Cooney, Gérard L'Heureux, Pete Antico, John Robotham, Gilbert Rosales, Richard L. Duran, George Randall, Jamie Bozian, Harley Zumbrum, Doug Dearth, David Roberson, Alexandra Balahoutis, Dick 'Skip' Evans, Sheldon Worthington, Robert Taft, Robert White, Chris Ellis, John Campbell, Brian Willems, Bill Cusack, Dabbs Greer, Marco Kyris, Kevin Gage, Sam Arnold, Dennis Burkley",3.4,116,"Newly-paroled former US Army ranger Cameron Poe is headed back to his wife, but must fly home aboard a prison transport flight dubbed “Jailbird” taking the “worst of the worst” prisoners, a group described as “pure predators”, to a new super-prison. Poe faces impossible odds when the transport plane is skyjacked mid-flight by the most vicious criminals in the country led by the mastermind — genius serial killer Cyrus “The Virus” Grissom, and backed by black militant Diamond Dog and psychopath Billy Bedlam. ×",https://a.ltrbxd.com/resized/film-poster/5/0/8/4/5/50845-con-air-0-230-0-345-crop.jpg?v=207f257fec,https://letterboxd.com/film/con-air/
Knock at the Cabin,"Blinding Edge Pictures, FilmNation Entertainment, Wishmore",2023,"Mystery, Horror, Thriller",M. Night Shyamalan,"M. Night Shyamalan, Ashwin Rajan, Marc Bienstock","Ben Aldridge, Jonathan Groff, Kristen Cui, Dave Bautista, Nikki Amuka-Bird, Rupert Grint, Abby Quinn, McKenna Kerrigan, Ian Merrill Peakes, Denise Nakano, Rose Luardo, Billy Vargus, Satomi Hofmann, Kevin Leung, Lee Avant, Odera Adimorah, Kat Murphy, Kittson O'Neill, Lya Yanne, M. Night Shyamalan, Clare Louise Frost, Hanna Gaffney, Monica Fleurette, Saria Chen",2.9,100,"While vacationing at a remote cabin, a young girl and her two fathers are taken hostage by four armed strangers who demand that the family make an unthinkable choice to avert the apocalypse. With limited access to the outside world, the family must decide what they believe before all is lost.",https://a.ltrbxd.com/resized/film-poster/5/5/8/0/5/6/558056-knock-at-the-cabin-0-230-0-345-crop.jpg?v=a60bcc3c00,https://letterboxd.com/film/knock-at-the-cabin/
Do Revenge,Likely Story,2022,"Romance, Thriller, Comedy",Jennifer Kaytin Robinson,"Anthony Bregman, Jennifer Kaytin Robinson, Peter Cron","Camila Mendes, Maya Hawke, Austin Abrams, Rish Shah, Sarah Michelle Gellar, Talia Ryder, Alisha Boe, Ava Capri, Jonathan Daviss, Paris Berelc, Maia Reficco, Sophie Turner, Rachel Matthews, Eliza Bennett, Francesca Reale, Olivia Sui, Jude Timothy Harris, Presley Coley, Sarah Ann Girma, Jordan Sherley, Michael Rub, Michelle Pokopac, Britt Douyon, Todd Allen Durkin, Lindsay Rootare, Jessi Goei, Phoebe French, Fay the Lizard, Maria Arroyo, Jillian Barrie, Denisse Beldin, Ryan Austin Bryant, Miguel Burgos, Soniliz Espina, Stejeanslo Filias, Aslean Janelle Florence, Trico Fullerton, Anthony Gaita, Sabrina Gallet, Kameron Hood, Kimberly Gonzalez, Ira Grossman, Haley Hammonds, Alex D. Jennings, Emily Koschella, Mary Kraft, Keila Lorena, Cassady McClincy-Zhang, Zack Olds, Isabelle Ramer, Stella Reimer, Ben Stafford, Donovan Velez, Abigail Wallis, Carter Williams",N/A,118,A dethroned queen bee at a posh private high school strikes a secret deal with an unassuming new student to enact revenge on one another’s enemies.,https://a.ltrbxd.com/resized/film-poster/6/8/3/1/9/4/683194-do-revenge-0-230-0-345-crop.jpg?v=19da99b72f,https://letterboxd.com/film/do-revenge/
First Blood,"Carolco Pictures, Anabasis N.V., Elcajo Productions, Cinema 84, Orion Pictures",1982,"War, Action, Adventure, Thriller",Ted Kotcheff,Buzz Feitshans,"Sylvester Stallone, Richard Crenna, Brian Dennehy, Bill McKinney, Jack Starrett, Michael Talbott, Chris Mulkey, John McLiam, Alf Humphreys, David Caruso, David L. Crowley, Don MacKay, Charles A. Tamburro, David Petersen, Craig Huston, Patrick Stack, Stephen E. Miller, Raimund Stamm, Robert Metcalfe, Stephen Dimopoulos, Bruce Greenwood, Earl Klein, Danny Wozna, Peter Lonstrup, Mike Winlaw, Donald Adams, David Menzies, Frank Richter, Grahman L. Galativk, Ian Hutchinson, Amy Alexander, Gary Hetherington, Alex Kliner, R.G. Miller, Bruce Paul Barbour, Stephen Chang, Suzee Pai, Robert Prowse, Jack Rigg, Helene Udy",3.8,93,"When former Green Beret John Rambo is harassed by local law enforcement and arrested for vagrancy, he is forced to flee into the mountains and wage an escalating one-man war against his pursuers.",https://a.ltrbxd.com/resized/film-poster/5/1/0/8/8/51088-first-blood-0-230-0-345-crop.jpg?v=79a5cef2a7,https://letterboxd.com/film/first-blood/
Bad Boys,"Columbia Pictures, Don Simpson/Jerry Bruckheimer Films",1995,"Comedy, Action, Thriller, Crime",Michael Bay,"Jerry Bruckheimer, Don Simpson","Will Smith, Martin Lawrence, Téa Leoni, Tchéky Karyo, Joe Pantoliano, Theresa Randle, Marg Helgenberger, Nestor Serrano, Julio Oscar Mechoso, Saverio Guerra, Anna Thomson, Kevin Corrigan, Michael Imperioli, Lisa Boyle, Michael Taliferro, Emmanuel Xuereb, Marc Macaulay, Ralph Gonzalez, Vic Manni, Frank John Hughes, Mike Kirton, Will Knickerbocker, Tiffany Samuels, Cory Hodges, Scott Cumberbatch, Joey Romano, Sam Ayers, Karen Alexander, Fawn Reed, Heather Davis, Maureen Gallagher, Juan F. Cejas, Ed Amatrudo, Jimmy Franzo, Tony Bolano, Shaun Toub, Marty McSorley, Norman Max Maxwell, Buddy Bolton, Stan Miller, Dug Jones, John Salley, Dana Mark, Mario Ernesto Sánchez, Kim Coates, Manny Perry",3.2,119,"Marcus Burnett is a henpecked family man. Mike Lowrey is a footloose and fancy free ladies’ man. Both Miami policemen, they have 72 hours to reclaim a consignment of drugs stolen from under their station’s nose. To complicate matters, in order to get the assistance of the sole witness to a murder, they have to pretend to be each other.",https://a.ltrbxd.com/resized/film-poster/4/6/8/7/0/46870-bad-boys-0-230-0-345-crop.jpg?v=e93721d2e0,https://letterboxd.com/film/bad-boys-1995/
The Passenger,Blumhouse Productions,2023,"Horror, Thriller",Carter Smith,"Paige Pemberton, Jennifer Sciarra","Kyle Gallner, Johnny Berchtold, Liza Weil, Billy Slaughter, Matthew Laureano, Jordan Sherley, Kanesha Washington, Lupe Leon, Merah Benoit, Glendon Ray Hobgood, Brooks Anne Hayes, Carson Allen Minniear, Sue Rock, Morgana Shaw, Angie Dillard, Rob Eubanks, Steven Skipper, Lena Clark Yousef, Betsy Borrego",3.3,98,"Randolph Bradley is perfectly content fading into the background, but when his coworker Benson snaps and goes on a violent killing spree, he’s forced to face his fears and confront his troubled past in order to find a way to survive.",https://a.ltrbxd.com/resized/film-poster/8/6/1/4/3/7/861437-the-passenger-0-230-0-345-crop.jpg?v=1234fe59f7,https://letterboxd.com/film/the-passenger-2023/
No Time to Die,"EON Productions, Metro-Goldwyn-Mayer",2021,"Action, Adventure, Thriller",Cary Joji Fukunaga,"Barbara Broccoli, Michael G. Wilson, Andrew Noakes, Gregg Wilson, Daniel Craig","Daniel Craig, Léa Seydoux, Rami Malek, Lashana Lynch, Ralph Fiennes, Ben Whishaw, Naomie Harris, Rory Kinnear, Jeffrey Wright, Billy Magnussen, Christoph Waltz, David Dencik, Ana de Armas, Dali Benssalah, Lisa-Dorah Sonnet, Coline Defaud, Mathilde Bourbin, Hugh Dennis, Priyanga Burford, Joe Grossi, Nicola Olivieri, Pio Amato, Javone Prince, Davina Moon, Mattia Lacovone, Giansalvatore Duca, Amy Morgan, Lizzie Winkler, Andrei Nova, Ernest Gromov, Gediminas Adomaitis, Andy Cheung, Brigitte Millar, Hayden Phillips, Winston Ellis, Adnan Rashed, Rae Lim, Chi Chan, Denis Khoroshko, Lourdes Faberes, Philip Philmar, Raymond Waring, Eliot Sumner, Rod Hunt, Michael Mercer, Gemmar Mcfarlane, Leighton Laing, Kimo Armstrong, Gordon Alexander, Steve Barnett, Tuncay Gunes, Clem So, Ahmed Bakare, Douglas Bunn, Toby Sauerback, Zoltan Rencsar, John Farrer, Paul O'Kelly, Michael G. Wilson, Michael Herne, Julian Ferro, Ross Donnelly, David Olawale Ayinde",3.5,163,"Bond has left active service and is enjoying a tranquil life in Jamaica. His peace is short-lived when his old friend Felix Leiter from the CIA turns up asking for help. The mission to rescue a kidnapped scientist turns out to be far more treacherous than expected, leading Bond onto the trail of a mysterious villain armed with dangerous new technology.",https://a.ltrbxd.com/resized/film-poster/3/0/5/9/6/4/305964-no-time-to-die-0-230-0-345-crop.jpg?v=4651ce5b05,https://letterboxd.com/film/no-time-to-die-2021/
Chaos: The Manson Murders,Moxie Pictures,2025,"Documentary, Crime",Errol Morris,Errol Morris,Charles Manson,2.7,96,"In August 1969, Charles Manson’s followers killed seven people on his orders. Why? Explore a conspiracy of mind control, CIA experiments and murder.",https://a.ltrbxd.com/resized/film-poster/1/3/0/5/8/3/1/1305831-chaos-the-manson-murders-0-230-0-345-crop.jpg?v=4e4b654965,https://letterboxd.com/film/chaos-the-manson-murders/
Ed Wood,Touchstone Pictures,1994,"Comedy, Drama, History",Tim Burton,"Tim Burton, Denise Di Novi, Michael Flynn","Johnny Depp, Martin Landau, Sarah Jessica Parker, Patricia Arquette, Jeffrey Jones, Bill Murray, Lisa Marie, Jim Myers, G. D. Spradlin, Vincent D'Onofrio, Mike Starr, Max Casella, Brent Hinkley, Juliet Landau, Clive Rosengren, Norman Alden, Leonard Termo, Ned Bellamy, Danny Dayton, Ross Manarchy, Bill Cusack, Stanley DeSantis, Biff Yeager, Joseph R. Gannascoli, Carmen Filpi, Lisa Malkiewicz, Melora Walters, Conrad Brooks, Don Amendolia, Reid Cruickshanks, Lionel Decker, Edmund L. Shaff, Gene LeBell, Bobby Slayton, Gretchen Becker, John Rice, Catherine Butterfield, Mary Portser, King Cotton, Don Hood, Matthew Barry, Ralph Monaco, Anthony Russell, Gregory Walcott, Charles C. Stevenson Jr., Rance Howard, Vasek Simek, Vinny Argiro, Korla Pandit, Patti Tippo, Ray Baker, Louis Lombardi, Jesse Hernandez, Jim Boyce, Ben Ryan Ganger, Charlie Holliday, Tommy Bertelsen, Adam Drescher, Ric Mancini, Daniel Riordan, Mickey Cottrell, Lena Banks, Maurice LaMarche, Ada Tai, Arlene Tai, Rayder Woods, Ralph Moratz, Bill Blair, Ryan Holihan",4.0,127,"The mostly true story of the legendary “worst director of all time”, who, with the help of his strange friends, filmed countless B-movies without ever becoming famous or successful.",https://a.ltrbxd.com/resized/sm/upload/1h/ci/kj/ms/zeXBzwpr785X0luB97WNK6C5iNS-0-230-0-345-crop.jpg?v=f2328570ff,https://letterboxd.com/film/ed-wood/
Annabelle,"Atomic Monster, New Line Cinema, The Safran Company, RatPac Entertainment",2014,Horror,John R. Leonetti,"Peter Safran, James Wan, Jenny Hinkey","Annabelle Wallis, Ward Horton, Tony Amendola, Alfre Woodard, Eric Ladin, Kerry O'Malley, Brian Howe, Ivar Brogger, Gabriel Bateman, Shiloh Nelson, Morganna Bridgers, Michelle Romano, Paige Diaz, Tree O'Toole, Trampas Thompson, Camden Singer, Keira Daniels, Richard Allan Jones, Christopher Shaw, Geoff Wehner, Sasha Sheldon, Robin Pearson Rose, Joseph Bishara, Emily Brobst",2.4,99,A couple begins to experience terrifying supernatural occurrences involving a vintage doll shortly after their home is invaded by satanic cultists.,https://a.ltrbxd.com/resized/sm/upload/h1/9m/2u/4k/annabelle-0-230-0-345-crop.jpg?v=b6e9f214e6,https://letterboxd.com/film/annabelle/
War for the Planet of the Apes,"20th Century Fox, TSG Entertainment, Chernin Entertainment",2017,"War, Drama, Science Fiction",Matt Reeves,"Amanda Silver, Peter Chernin, Dylan Clark, Rick Jaffa","Andy Serkis, Woody Harrelson, Karin Konoval, Terry Notary, Steve Zahn, Amiah Miller, Ty Olsson, Michael Adamthwaite, Toby Kebbell, Gabriel Chavarria, Sara Canning, Judy Greer, Devyn Dalton, Aleks Paunovic, Alessandro Juliani, Max Lloyd-Jones, Timothy Webber, Lauro David Chartrand-DelValle, Shaun Omaid, Roger Cross, Mercedes de la Zerda, Doug Chapman, James Pizzinato, Chad Rook, Dean Redman, Steve Baran, Sandy Robson, Levi Meaden, Billy Wickman, Albert Nicholas, Kyle Horton, Paul Luongo, Thomas Potter, Mathew Yanagiya, Skye Notary, Willow Notary, Finn Notary, Phoenix Notary, Sadie Aperlo, Matilda Aperlo, Andrew Alexander Reeves",3.8,140,"Caesar and his apes are forced into a deadly conflict with an army of humans led by a ruthless Colonel. After the apes suffer unimaginable losses, Caesar wrestles with his darker instincts and begins his own mythic quest to avenge his kind. As the journey finally brings them face to face, Caesar and the Colonel are pitted against each other in an epic battle that will determine the fate of both their species and the future of the planet.",https://a.ltrbxd.com/resized/sm/upload/8x/qv/nm/63/ijQHiImv16vNSeZQsmih04kwn0C-0-230-0-345-crop.jpg?v=fa3e7ba9ed,https://letterboxd.com/film/war-for-the-planet-of-the-apes/
