Title,Studios,Year,Genre,Director,Producers,Cast,AvgRating,Duration,Description,Poster URL,Page URL
Grindhouse,"Yer Dead, Dimension Films, Big Talk Studios, Eyetronics, Rodriguez International Pictures, Troublemaker Studios",2007,"Action, Horror, Thriller","Robert Rodriguez, Quentin Tarantino","Elizabeth Avellan, Rob Cotterill, Daniel Frisch, Andy Gould, Tom Proper, Robert Rodriguez, Eli Roth, Gabriel Roth, Pilar Savone, Erica Steinberg, Quentin Tarantino","Kurt Russell, Rose McGowan, Zoë Bell, Freddy Rodríguez, Rosario Dawson, Marley Shelton, Vanessa Ferlito, Josh Brolin, Sydney Tamiia Poitier, Jeff Fahey, Mary Elizabeth Winstead, Michael Biehn, Tracie Thoms, Jordan Ladd, Bruce Willis, Quentin Tarantino, Marcy Harriell, Eli Roth, Omar Doom, Michael Bacall, Monica Staggs, Jonathan Loughran, Marta Mendoza, Tim Murphy, Melissa Arcaro, Michael Parks, James Parks, Electra Avellan, Elise Avellan, Eurlyne Epper, Jamie L. Dunno, Shannon Hazlett, Rebel Rodriguez, Naveen Andrews, Julio Oscar Mechoso, Fergie, Nicky Katt, Hung Nguyen, Cecilia Conti, Tommy Nix, Tom Savini, Carlos Gallardo, Skip Reissig, Gregory Kelly, Troy Robinson, Derek Southers, Jerili Romeo, Felix Sabates, Doran Ingram, Johnny Reno, Danny Trejo, Cheech Marin, Udo Kier, Sheri Moon Zombie, Tom Towles, Sybil Danning, Bill Moseley, Nicolas Cage, Lorielle New, Oleg Prudius, Emily Booth, MyAnna Buring, Simon Pegg, Helen Kim, Jason Isaacs, Will Arnett, Emmy Robbin, Matthew Macfadyen, Lucy Punch, Rafe Spall, Nick Frost, Georgina Chapman, Katie Melua, Lee Ingleby, Stuart Wilson, Mark Gatiss, Robert Rodriguez, Peter Serafinowicz, Michael Smiley, Jay Hernandez, Jeff Rendell, Michael Deak, Emmy Rossum, Liliyan Malkina",3.7,191,"Grindhouse combines Robert Rodriguez’s Planet Terror, a horror comedy about a group of survivors who battle zombie-like creatures, and Quentin Tarantino’s Death Proof, an action thriller about a murderous stuntman who kills young women with modified vehicles. It is presented as a double feature with fictitious exploitation trailers before each segment.",https://a.ltrbxd.com/resized/film-poster/2/1/1/2/4/0/211240-grindhouse-0-230-0-345-crop.jpg?v=5c881ec7bf,https://letterboxd.com/film/grindhouse/
Batman Beyond: Return of the Joker,Warner Bros. Animation,2000,"Action, Thriller, Animation, Science Fiction",Curt Geda,"Glen Murakami, Alan Burnett, Paul Dini","Will Friedle, Kevin Conroy, Mark Hamill, Angie Harmon, Dean Stockwell, Arleen Sorkin, Tara Strong, Mathew Valencia, Andrea Romano, Melissa Joan Hart, Henry Rollins, Michael Rosenbaum, Don Harvey, Frank Welker, Rachael Leigh Cook, Lauren Tom, Teri Garr, Ryan O'Donohue, Vernee Watson-Johnson, Mary Scheer, Bruce Timm, Mark Jonathan Davis",3.8,77,"The Joker is back with a vengeance, and Neo-Gotham’s Dark Knight, Terry McGinnis, needs answers as he stands alone to face the old Gotham’s most infamous Clown Prince of Crime.",https://a.ltrbxd.com/resized/film-poster/4/1/7/1/9/41719-batman-beyond-return-of-the-joker-0-230-0-345-crop.jpg?v=9327ea7c7f,https://letterboxd.com/film/batman-beyond-return-of-the-joker/
Pooh's Heffalump Movie,"DisneyToon Studios, Walt Disney Pictures",2005,"Comedy, Fantasy, Family, Animation",Frank Nissen,"Jessica Koplos, Clay Renfroe","Jim Cummings, John Fiedler, Kath Soucie, Nikita Hopkins, Ken Sansom, Peter Cullen, Kyle Stanger, Brenda Blethyn",3.5,68,"Who or what exactly is a Heffalump? The lovable residents of the Hundred Acre Wood – Winnie the Pooh, Rabbit, Tigger, Eeyore, Kanga and the rest of the pack – embark on a journey of discovery in search of the elusive Heffalump. But as is always the case, this unusual road trip opens their eyes to so much more than just the creature they’re seeking.",https://a.ltrbxd.com/resized/film-poster/4/3/6/8/3/43683-pooh-s-heffalump-movie-0-230-0-345-crop.jpg?v=21eb17f418,https://letterboxd.com/film/poohs-heffalump-movie/
The Nutcracker and the Four Realms,"Walt Disney Pictures, The Mark Gordon Company",2018,"Adventure, Fantasy, Family","Lasse Hallström, Joe Johnston","Mark Gordon, Marc Weigert, Larry Franco, Alison Beckett, Jeremy Johns","Mackenzie Foy, Jayden Fowora-Knight, Tom Sweet, Keira Knightley, Helen Mirren, Morgan Freeman, Eugenio Derbez, Matthew Macfadyen, Richard E. Grant, Sergei Polunin, Misty Copeland, Anna Madeley, Ellie Bamber, Jack Whitehall, Omid Djalili, Gustavo Dudamel, Nick Mohammed, Charles Streeter, Craig Garner, Meera Syal, Max Westwell, Aaron Smyth, Sophie Apollonia, Zoe Arshamian, Diogo Barbosa, Harris Bell, Julia Conway, James Butcher, Jonathan Caguioa, Lil Buck, Ocean Navarro, Gemma Wilks, Trent Owers, Bethany Harrison",2.5,99,"When Clara’s mother leaves her a mysterious gift, she embarks on a journey to four secret realms—where she discovers her greatest strength could change the world.",https://a.ltrbxd.com/resized/film-poster/3/5/9/9/6/9/359969-the-nutcracker-and-the-four-realms-0-230-0-345-crop.jpg?v=2c24bcc160,https://letterboxd.com/film/the-nutcracker-and-the-four-realms/
The Life and Death of Colonel Blimp,"The Archers, J. Arthur Rank Organisation",1943,"War, Drama, Romance, Comedy","Michael Powell, Emeric Pressburger","Michael Powell, Emeric Pressburger","Roger Livesey, Deborah Kerr, Anton Walbrook, Roland Culver, James McKechnie, Arthur Wontner, David Hutcheson, Ursula Jeans, John Laurie, Harry Welchman, Robert Harris, A.E. Matthews, Theodore Zichy, Jane Millican, Neville Mapp, Vincent Holman, Spencer Trevor, James Knight, Dennis Arundell, David Ward, Jan Van Loewen, Valentine Dyall, Carl Jaffe, Albert Lieven, Eric Maturin, Frith Banbury, Phyllis Morris, Muriel Aked, Reginald Tate, Yvonne Andre, Marjorie Gresley, Felix Aylmer, Norman Pierce, Edward Cooper, Joan Swinstead, Pat McGrath",4.2,163,"General Candy, who’s overseeing an English squad in 1943, is a veteran leader who doesn’t have the respect of the men he’s training and is considered out-of-touch with what’s needed to win the war. But it wasn’t always this way. Flashing back to his early career in the Boer War and World War I, we see a dashing young officer whose life has been shaped by three different women, and by a lasting friendship with a German soldier.",https://a.ltrbxd.com/resized/film-poster/3/6/3/3/4/36334-the-life-and-death-of-colonel-blimp-0-230-0-345-crop.jpg?v=05be0ad391,https://letterboxd.com/film/the-life-and-death-of-colonel-blimp/
Cat City,vewn,2017,"Animation, Drama, Comedy",Victoria Vincent,Victoria Vincent,"Jonni Peppers, Isabel Higgins, Aster Pang",4.0,3,A cat leaves his life as a pet to get a job in the big city.,https://a.ltrbxd.com/resized/film-poster/4/0/0/6/3/0/400630-cat-city-0-230-0-345-crop.jpg?v=7d902c1187,https://letterboxd.com/film/cat-city-2017/
Butt Boy,Tiny Cinema,2019,"Comedy, Thriller, Horror, Fantasy",Tyler Cornack,"Ryan Koch, Austin Lewis, Brian Wolfe","Tyler Rice, Tyler Cornack, Shelby Dash, Brad Potts, Austin Lewis, Robert Moss, Tyler Dryden, Kai Henderson, Wilky Lau, Colleen Elizabeth Miller, Nino Hara, Kristina Clifford, Anna Wholey, Michael Lugenbuehl, Angela Jones, Rhoda Pell",3.0,99,"Detective Fox loves work and alcohol. After he goes to AA, his sponsor, Chip, becomes a suspect in his investigation for a missing kid. Fox believes people are disappearing up Chip’s butt.",https://a.ltrbxd.com/resized/film-poster/5/5/1/2/3/7/551237-butt-boy-0-230-0-345-crop.jpg?v=a10dfdd872,https://letterboxd.com/film/butt-boy/
Heaven Adores You,"ZAP Zoetrope Aubry Productions, Blowback Pictures",2014,"Documentary, Music",Nickolas Dylan Rossi,"Marc Smolowitz, Kevin Moyer, Nickolas Dylan Rossi","Jon Brion, Elliott Smith, Rossie Harris, Autumn de Wilde, Chris Douridas, Mark Flanagan, Roblyn Crawford, Jack Black, Joanna Bolme, Larry Crane",3.5,104,"Heaven Adores You is an intimate, meditative inquiry into the life and music of Elliott Smith. By threading the music of Elliott Smith through the dense, yet often isolating landscapes of the three major cities he lived in – Portland, New York City, Los Angeles – Heaven Adores You presents a visual journey and an earnest review of the singer’s prolific songwriting and the impact it continues to have on fans, friends, and fellow musicians.",https://a.ltrbxd.com/resized/film-poster/2/0/0/8/4/7/200847-heaven-adores-you-0-230-0-345-crop.jpg?v=03a44fa8aa,https://letterboxd.com/film/heaven-adores-you/
Caligula,"Penthouse Films International, Felix Cinematografica",1979,"Drama, History",Tinto Brass,"Bob Guccione, Franco Rossellini","Malcolm McDowell, Teresa Ann Savoy, Helen Mirren, Peter O'Toole, John Steiner, Guido Mannari, Paolo Bonacelli, Leopoldo Trieste, Giancarlo Badessi, Mirella D'Angelo, Anneka Di Lorenzo, Lori Wagner, Adriana Asti, John Gielgud, Bruno Brive, Rick Parets, Paula Mitchell, Osiride Pevarello, Donato Placido, John Francis Lane",N/A,156,"After the death of the paranoid emperor Tiberius, Caligula, his heir, seizes power and plunges the empire into a bloody spiral of madness and depravity.",https://s.ltrbxd.com/static/img/empty-poster-230-nQeuntFa.png,https://letterboxd.com/film/caligula/
The Wicker Man,"Millennium Media, Saturn Films, EFO Films, Equity Pictures Medienfonds GmbH & Co. KG III, Nu Image, Alcon Entertainment, Emmett/Furla Films",2006,"Thriller, Horror, Mystery",Neil LaBute,"Nicolas Cage, Randall Emmett, Norman Golightly, Avi Lerner, Simon Franks, Manfred D. Heid, Zygi Kamasa, Gerd Koechlin, Shawn Williamson, Boaz Davidson, John Thompson","Nicolas Cage, Ellen Burstyn, Kate Beahan, Frances Conroy, Molly Parker, Leelee Sobieski, Diane Delano, Michael Wiseman, Erika-Shaye Gair, Christa Campbell, Emily Holmes, Zemphira Gosling, Matthew Walker, Mary Black, Christine Willes, Sophie Hough, David Purvis, Xantha Radley, Tania Saulnier, Anna Van Hooft, Moraea Bieber, Jayda Bieber, Talia Ranger, Kendall Cross, Simon Longmore, Andre Danyliu, Jacqueline Robbins, Joyce Robbins, Aaron Eckhart, James Franco, Jason Ritter, Monique Ganderton, George A. Murphy, Linley Subryan",2.0,102,"A sheriff investigating the disappearance of a young girl from a small island discovers there’s a larger mystery to solve among the island’s secretive, neo-pagan community.",https://a.ltrbxd.com/resized/film-poster/4/6/8/9/6/46896-the-wicker-man-0-230-0-345-crop.jpg?v=f17c94b619,https://letterboxd.com/film/the-wicker-man-2006/
The Promised Neverland,CloverWorks,2019,"Mystery, Animation, Crime, Drama","Hidekazu Hara, Yoshiki Kitai",Kazuki Oshima,"Sumire Morohoshi, Mariya Ise, Shinei Ueki, Erisa Kuon, Lynn, Shizuka Ishigami, Ai Kayano, Mari Hino, Yuko Mori, Nao Shiraki, Coco Hayashi, Yoshino Aoyama, Hiyori Kouno",3.8,276,"Surrounded by a forest and a gated entrance, the Grace Field House is inhabited by orphans happily living together as one big family, looked after by their “Mama,” Isabella. Although they are required to take tests daily, the children are free to spend their time as they see fit, usually playing outside, as long as they do not venture too far from the orphanage — a rule they are expected to follow no matter what. However, all good times must come to an end, as every few months, a child is adopted and sent to live with their new family… never to be heard from again.However, the three oldest siblings have their suspicions about what is actually happening at the orphanage, and they are about to discover the cruel fate that awaits the children living at Grace Field, including the twisted nature of their beloved Mama. ×",https://a.ltrbxd.com/resized/film-poster/1/2/5/2/8/2/2/1252822-the-promised-neverland-2019-1-0-230-0-345-crop.jpg?v=3eabad89a6,https://letterboxd.com/film/the-promised-neverland-2019-1/
Song of Avignon,N/A,1998,Documentary,Jonas Mekas,N/A,"Angus MacLise, Jonas Mekas",4.2,9,Reflections on my 1966 trip to Avignon that helped me to survive a deep crisis I was going through. Texts from my diaries of that period on the soundtrack are read by Angus MacLise.,https://a.ltrbxd.com/resized/film-poster/2/0/5/0/2/6/205026-song-of-avignon-0-230-0-345-crop.jpg?v=bc8680f86b,https://letterboxd.com/film/song-of-avignon/
Tale of Tales,"Archimede, Le Pacte, HanWay Films, New Sparta Films, Recorded Picture Company, RAI",2015,"Romance, Horror, Fantasy",Matteo Garrone,"Matteo Garrone, Jeremy Thomas, Jean Labadie, Paolo Del Brocco, Anne-Laure Labadie","Salma Hayek Pinault, Vincent Cassel, Toby Jones, Shirley Henderson, Hayley Carmichael, Bebe Cave, Stacy Martin, Christian Lees, Jonah Lees, Guillaume Delaunay, Alba Rohrwacher, Massimo Ceccherini, John C. Reilly, Laura Pizzirani, Franco Pistoni, Jessie Cave, Michael Martini, Alessandro Campagna, Lorenzo Bernardi, Giselda Volodi, Giuseppina Cervizzi, Luisa Ragusa, Giovanni Calcagno, Stefano Strufaldi, Giuseppe Carnemolla, Diego Parenti, Gherardo Toccafondi, Lorenzo Mastronardi, Paolo Risi, Giuliano Del Taglia, Betty La Padula, Kathryn Hunter, Ryan McParland, Kenneth Collard, Renato Scarpa, Guenda Goria, Catrinel Marlon, Talita Bartoli, Cristiana Vaccaro, Elizabeth Kinnear, Andrea Rodriguez, Sabrina La Torre, Eric MacLennan, Nicola Sloane, Davide Campagna, Giulio Beranek, Vincenzo Nemolato, Martina Laticignola, Andrea Loreni, Vincenzo Pellegrini, Francesco Lo Mascolo, Maxence Dinant, Tiziana Buldini",3.3,134,The Queen of Selvascura risks everything to be a mother; the King of Roccaforte falls in love with the voice of a mysterious girl; the King of Altomonte becomes obsessed with a flea and neglects his daughter.,https://a.ltrbxd.com/resized/film-poster/2/4/1/4/6/2/241462-tale-of-tales-0-230-0-345-crop.jpg?v=9488caac62,https://letterboxd.com/film/tale-of-tales-2015/
Haru,Kouwa International,1996,"Romance, Drama",Yoshimitsu Morita,"Katsuhiko Aoki, Kazuko Misawa","Eri Fukatsu, Seiyo Uchino, Naho Toda, Kazufumi Miyazawa, Kotaro Takeshita, Masaharu Tsuruku, Sei Hiraizumi, Noriko Kojima, Aya Mizuno, Yuka Motohashi, Takayuki Sakai, Masaaki Senda, Noriko Suzuki, Tetsuya Ushio, Masako Yagi, Naoko Yamazaki",4.1,118,A young Tokyo businessman joins an online movie forum and develops a special bond with one of its members through back and forth e-mails.,https://a.ltrbxd.com/resized/film-poster/1/8/5/0/4/6/185046-haru-0-230-0-345-crop.jpg?v=0ab7020ee4,https://letterboxd.com/film/haru/
Mahaan,Seven Screen Studios,2022,"Drama, Action, Crime",Karthik Subbaraj,Lalit Kumar,"Vikram, Dhruv Vikram, Bobby Simha, Simran, Sananth, Muthukumar, Ramachandran Durairaj, Subathra Robert, Deepak Paramesh, Gajaraj, Aadukalam Naren, Master Raghavan, Akshath Das, Balaji Sakthivel, Vani Bhojan, Murugavel, Vishalini Daniel, Benito Franklin",3.5,163,"A man’s family leaves him when he strays from the path of ideological living in his search for personal freedom. However, as he realizes his ambitions, he also misses the presence of his son in his life. Having fulfilled his dream of becoming a billionaire, does life give him a second chance to be a father?",https://a.ltrbxd.com/resized/film-poster/7/2/1/7/2/8/721728-mahaan-0-230-0-345-crop.jpg?v=5dc3c453ef,https://letterboxd.com/film/mahaan-2022/
The 3 Rs,Viennale,2011,N/A,David Lynch,N/A,Mindy Ramaker,3.2,N/A,"One-minute short film, used as a trailer for the Vienna International Film Festival.",https://a.ltrbxd.com/resized/film-poster/1/2/0/9/2/4/120924-the-3-rs-0-230-0-345-crop.jpg?v=083b51402f,https://letterboxd.com/film/the-3-rs-2011-4/
Alpha Dog,"A-Mark Entertainment, Universal Pictures, Sidney Kimmel Entertainment, Capitol Films, VIP 2 Medienfonds",2006,"Thriller, Drama, Crime",Nick Cassavetes,"Sidney Kimmel, Chuck Pacheco, Michael Mehas, Matthew Barry, Nancy Green-Keyes","Emile Hirsch, Bruce Willis, Amanda Seyfried, Justin Timberlake, Shawn Hatosy, Ben Foster, Harry Dean Stanton, Matthew Barry, Fernando Vargas, Vincent Kartheiser, Alex Solowitz, Alec Vigil, Frank Cassavetes, Nicole Dubos, Regina Rice, Laura Nativo, Amber Heard, Anton Yelchin, David Thornton, Sharon Stone, Olivia Wilde, Heather Wahlquist, Shera Danese, Nancy De Mayo, Xan Cassavetes, Dominique Swain, Charity Shea, Lukas Haas, Heather Elizabeth Parkhurst, Jesse Erwin, Paul Johansson, Danny A. Abeckaser, James Molina, Chuck Pacheco, Frank Peluso, Joshua Alba, Chris Kinkade, Christopher Rodriguez Marquette, Alex Kingston, Bobby Cooper, Janet Jones, Alan Thicke, Rick Salomon, Adrianna Belan, Holt McCallany, Shirley Kurata, Mario Ardila, Jr., Matt Borlenghi, Curt Clendenin, Angela Meryl, Bernadette Pérez, Emilio Roso, Kristen Williams, Greg Williams, Devin Kamin, Patrick Nguyen, Natasha Elliott, Stephanie A. Fowler, Sadie",3.3,122,"Johnny Truelove likes to see himself as tough. He’s the son of an underworld figure and a drug dealer. Johnny also likes to get tough when things don’t go his way. When Jake Mazursky fails to pay up for Johnny, things get worse for the Mazursky family, as Johnny and his ‘gang’ kidnap Jake’s 15 year old brother and holds him hostage. Problem now is what to do with ‘stolen boy?’",https://a.ltrbxd.com/resized/film-poster/4/8/0/2/0/48020-alpha-dog-0-230-0-345-crop.jpg?v=8c73846d74,https://letterboxd.com/film/alpha-dog/
Roll Bounce,"Fox Searchlight Pictures, Fox 2000 Pictures",2005,"Comedy, Drama, Family",Malcolm D. Lee,"Tyrone D. Dixon, George Tillman Jr., Robert Teitel","Shad Moss, Brandon T. Jackson, Chi McBride, Marcus T. Paulk, Rick Gonzalez, Khleo Thomas, Busisiwe Irvin, Jurnee Smollett, Kellita Smith, Mike Epps, Charlie Murphy, Meagan Good, Nick Cannon, Wesley Jonathan, Paul Wesley, Daniel Yabut, Wayne Brady, Darryl 'DMC' McDaniels, Joseph Hansa, Kat Tuohy, Marcia Wright, Cassandra Lewis, Deanna Reed-Foster, Mark Simmons, Ernest Perry Jr., Tim Kazurinsky, Heather O'Brien, Kelly Jay, Samirah Garnett, Damon Williams, Norman Vance III, Tammy Fey, Tai'isha Davis, Tina Au, Todd Donoho, Booker T. Mattison",3.4,112,"In the summer of 1978, a teenager and his group of friends face new challenges when their neighborhood roller-skating rink closes, forcing them to visit a different rink.",https://a.ltrbxd.com/resized/film-poster/4/3/0/0/8/43008-roll-bounce-0-230-0-345-crop.jpg?v=2f1f4abbe8,https://letterboxd.com/film/roll-bounce/
Two,N/A,1965,"Family, Drama",Satyajit Ray,N/A,Ravi Kiran,4.0,12,"This short film shows an encounter, through a series of games, between a street child from the shantytowns and a child of a rich family, stationed at his window. The film has no dialogue and the action moves through the attempts at one-upmanship evident in their successive display of their toys. Their rivalry (a kite shot down by a toy rifle, for example) concludes with the opposition between the world of noise (the toys inside the house) and that of music (the street child’s flute).  Preserved by the Academy Film Archive in 2006. ×",https://a.ltrbxd.com/resized/film-poster/1/3/7/7/6/2/137762-two-0-230-0-345-crop.jpg?v=6031e190ae,https://letterboxd.com/film/two-1965/
Willow Creek,Jerkschool Productions,2013,"Horror, Mystery, Thriller",Bobcat Goldthwait,"Aimee Pierson, Sarah de Sa Rego, Alexie Gilmore, Bryce Johnson, Jason Stewart","Alexie Gilmore, Bryce Johnson, Peter Jason, Timmy Red, Bucky Sinister, Laura Montagna",2.6,80,"Looking to make a splash online with his research videos into the existence of Bigfoot, Jim and his girlfriend Kelly take a camping trip to the small town of Willow Creek, California, and the surrounding mountains where the infamous footage of the supposed sasquatch was filmed.",https://a.ltrbxd.com/resized/film-poster/1/3/4/1/4/3/134143-willow-creek-0-230-0-345-crop.jpg?v=8397ddefa5,https://letterboxd.com/film/willow-creek/
The Innkeepers,"Dark Sky Films, Glass Eye Pix",2011,"Thriller, Horror",Ti West,"Ti West, Peter Phok, Larry Fessenden, Derek Curl","Sara Paxton, Pat Healy, Kelly McGillis, George Riddle, Lena Dunham, John Speredakos, Brenda Cooney, Alison Bartlett, Jake Ryan, Sean Reid, Kurt Venghaus, Thomas Mahoney, Michael Martin, Michael P. Castelli",2.9,101,"During the final days at the Yankee Pedlar Inn, two employees determined to reveal the hotel’s haunted past begin to experience disturbing events as old guests check in for a stay.",https://a.ltrbxd.com/resized/film-poster/7/8/4/6/7846-the-innkeepers-0-230-0-345-crop.jpg?v=776d589b50,https://letterboxd.com/film/the-innkeepers/
Werner Herzog Eats His Shoe,N/A,1980,"Documentary, Comedy",Les Blank,"Les Blank, Tom Luddy","Werner Herzog, Errol Morris, Tom Luddy, Michael Goodwin, Chris Strachwitz, Phil Harberts, Alice Waters",3.8,21,Directors Werner Herzog and Errol Morris make a bet which results in Herzog living up to his promise that he would eat his shoe if Errol Morris ever completed the film Gates of Heaven.,https://a.ltrbxd.com/resized/film-poster/8/1/1/8/6/81186-werner-herzog-eats-his-shoe-0-230-0-345-crop.jpg?v=75381b2dd6,https://letterboxd.com/film/werner-herzog-eats-his-shoe/
The Band Wagon,Metro-Goldwyn-Mayer,1953,"Comedy, Romance, Music",Vincente Minnelli,"Arthur Freed, Roger Edens","Fred Astaire, Cyd Charisse, Oscar Levant, Nanette Fabray, Jack Buchanan, James Mitchell, Robert Gist, Ava Gardner, Don Beddoe, Henry Corden, Steve Forrest, Bess Flowers, India Adams, Douglas Fowley, Thurston Hall, Frank McLure, Julie Newmar, Colin Kenny, Bert Stevens, Harold Miller, Brandon Beach, Leroy Daniels, Dorinda Clifton, Emory Parnell, Madge Blake, James Carlisle, Dick Cherney, Tom Coleman, Roy Engel, Al Ferguson, Jack Gargan, Herschel Graham, Ted Jordan, John Lupton, Ann McCrea, Manuel París, Frank J. Scannell, Hal Taggart, Herb Vigran, Dick Gordon, Rudy Germane",3.8,112,A Broadway artiste turns a faded film star’s comeback vehicle into an artsy flop.,https://a.ltrbxd.com/resized/film-poster/3/2/9/1/4/32914-the-band-wagon-0-230-0-345-crop.jpg?v=f1075115d3,https://letterboxd.com/film/the-band-wagon/
Cats,"PolyGram Filmed Entertainment, KQED",1998,Music,"David Mallet, Trevor Nunn",Andrew Lloyd Webber,"Elaine Paige, John Mills, Ken Page, Rosemarie Ford, Michael Gruber, John Partridge, Aeva May, Geoffrey Garratt, James Barron, Jo Gibb, Drew Varley, Susie McKenna, Jacob Brent, Susan Jane Tanner, Phyllida Crowley Smith, Bryn Walters, Veerle Casteleyn, Tommi Sliiden, Kaye Brown, Karl Morgan, Leah Sue Morland, Jo Bingham, Fergus Logan, Tony Timberlake, Jason Gardiner, Femi Taylor, Frank Thompson, Rebecca Parker, David Arneil, Paul Baker, Vicky Coote, Helen Massie, Sally Bentley, David Combes, Mary Carewe, Robert Fardell, Mark Frederick, Michael Dore, Jacqueline Barron, Anne Skates, Janet Mooney",3.6,120,"“Jellicle” cats join for a Jellicle ball where they rejoice with their leader, Old Deuteronomy. One cat will be chosen to go to the “Heavyside Layer” and be reborn.",https://a.ltrbxd.com/resized/film-poster/3/5/1/9/5/35195-cats-the-musical-0-230-0-345-crop.jpg?v=41292e904c,https://letterboxd.com/film/cats/
The Forbidden Kingdom,"Casey Silver Productions, China Film Co-Production Corp., Relativity Media, Lionsgate, The Weinstein Company, Arclight Films, Huayi Brothers Pictures, J&J Project, Salon Films",2008,"Action, Fantasy, Adventure",Rob Minkoff,"Casey Silver, Scott Fischer, Philip Lee","Jackie Chan, Jet Li, Michael Angarano, Liu Yifei, Li Bingbing, Collin Chou, Morgan Benoit, Jack Posobiec, Thomas McDonell, Juana Collignon, Zhi Ma Gui, Shen Shou He, Bin Jiang, Shaohua Yang, Yu Yuan Zeng, David Will No, Sam Wong Ming-Sing",2.9,104,"An American teenager who is obsessed with Hong Kong cinema and kung-fu classics makes an extraordinary discovery in a Chinatown pawnshop: the legendary stick weapon of the Chinese sage and warrior, the Monkey King. With the lost relic in hand, the teenager unexpectedly finds himself travelling back to ancient China to join a crew of warriors from martial arts lore on a dangerous quest to free the imprisoned Monkey King.",https://a.ltrbxd.com/resized/film-poster/5/0/8/2/3/50823-the-forbidden-kingdom-0-230-0-345-crop.jpg?v=c2cb083d62,https://letterboxd.com/film/the-forbidden-kingdom/
The Damned,"Eichberg-Film, Ital-Noleggio Cinematografico, Pegaso Cinematografica, Praesidens (IT)",1969,"Drama, History",Luchino Visconti,"Attilio D'Onofrio, Alfred Levy, Ever Haggiag","Dirk Bogarde, Ingrid Thulin, Helmut Griem, Helmut Berger, Renaud Verley, Umberto Orsini, Reinhard Kolldehoff, Albrecht Schoenhals, Florinda Bolkan, Nora Ricci, Charlotte Rampling, Irina Wanka, Karin Mittendorf, Valentina Ricci, Wolfgang Hillinger, Bill Vanders, Howard Nelson Rubien, Werner Hasselmann, Peter Dane, Mark Salvage, Karl-Otto Alberty, John Frederick, Richard Beach, Klaus Höhne, Ernst Kuhr, Peter Brandt, Wolfgang Ehrlich, Ester Carloni, Antonietta Fiorito, Jessica Dublin, Michele Scalera, Al Cliver",3.8,158,"In the early days of Nazi Germany, a powerful noble family must adjust to life under the new dictatorship regime.",https://a.ltrbxd.com/resized/film-poster/2/3/1/8/1/23181-the-damned-0-230-0-345-crop.jpg?v=cb02261b6f,https://letterboxd.com/film/the-damned/
Snow White: A Tale of Terror,"Interscope Communications, PolyGram Filmed Entertainment",1997,"Horror, Fantasy",Michael Cohn,Tom Engelman,"Sigourney Weaver, Sam Neill, Monica Keena, Gil Bellows, Brian Glover, David Conrad, Anthony Brophy, Andrew Tiernan, Taryn Davis, Dale Wyatt, Joanna Roth, Bryan Pringle, Frances Cuka, Chris Bauer, Miroslav Táborský, John Edward Allen",3.0,100,"When young Lili’s mother dies in childbirth, her father remarries Lady Claudia, a woman ruled by an evil mirror with the power to make her queen of all living things.  After escaping an attempt on her life, Lili finds herself lost in a dark forest, where living happily ever after seems unlikely.",https://a.ltrbxd.com/resized/film-poster/4/7/3/5/2/47352-snow-white-a-tale-of-terror-0-230-0-345-crop.jpg?v=297c576cd1,https://letterboxd.com/film/snow-white-a-tale-of-terror/
